index,published,keyword,domain,language,valid,title,description,url,image,archive,content,quote,de,en,la,added
58f2e13028fc6258ea991a3dad7d3432,2025-11-10T07:53:55Z,'Taifun',www.stern.de,de,1.0,"Abgeschwächter Taifun ""Fung-wong"" dreht von den Philippinen in Richtung Taiwan ab","Der mittlerweile abgeschwächte Taifun ""Fung-wong"" ist am Montag von den Philippinen abgezogen, nachdem er dort eine Spur der Verwüstung hinterlassen hat. Der staatliche Wetterdienst teilte mit, dass der Taifun voraussichtlich in Richtung Taiwan abdrehen werde…",https://www.stern.de/news/abgeschwaechter-taifun--fung-wong--dreht-von-den-philippinen-in-richtung-taiwan-ab-36298230.html,https://image.stern.de/36298232/t/wP/v1/w1440/r1.7778/-/10--arbeiter-begutachten-umgestuerzte-baeume-in-manila---2a88581a5a5b007c.jpg,,"Kopiere den aktuellen Link
Zur Merkliste hinzufügen
Der mittlerweile abgeschwächte Taifun ""Fung-wong"" ist am Montag von den Philippinen abgezogen, nachdem er dort eine Spur der Verwüstung hinterlas… [+2774 chars]",,"Abgeschwächter Taifun ""Fung-wong"" dreht von den Philippinen in Richtung Taiwan ab. Der mittlerweile abgeschwächte Taifun ""Fung-wong"" ist am Montag von den Philippinen abgezogen, nachdem er dort eine Spur der Verwüstung hinterlassen hat. Der staatliche Wetterdienst teilte mit, dass der Taifun voraussichtlich in Richtung Taiwan abdrehen werde…","Weakened Typhoon “Fung-wong” moves from the Philippines towards Taiwan. The now weakened typhoon ""Fung-wong"" moved away from the Philippines on Monday after leaving a trail of destruction there. The state weather service said the typhoon was expected to turn toward Taiwan...","Typhon infirmatus a Philippinis versus Taiwan ""Fung-wong"" movet. Nunc typhon ""Fung-wong"" debilitatus est e Philippinis die Lunae postquam vestigia exitii ibi relicta sunt. Status tempestatis officium dixit typhonum expectatum esse se ad Taiwan...",2025-10-21 19:24:47+00:00
f4dfd458b9467ae44900caa33c0dc07c,2025-11-10T13:07:21Z,'Wirbelstürme Klimawandel',www.focus.de,de,1.0,Philippinische Familie rettet sich über Dach vor Super-Taifun,"Ein philippinischer Familienvater musste sein Hausdach einschlagen, um seine Familie vor dem Super-Taifun zu retten. Wenige Tage nach dem ersten Wirbelsturm trifft die Philippinen jetzt die nächste Katastrophe.",https://www.focus.de/politik/ausland/philippinische-familie-rettet-sich-ueber-dach-vor-super-taifun_5e12b573-31c1-4b97-811d-25b0693c6d01.html,https://quadro.burda-forward.de/ctf/a00ee5cb-a7d6-4045-a0da-a46f1cbb19b7.dd0b8d22-8adc-417e-9de7-1ee150a72716.jpg?im=RegionOfInterestCrop%3D%281200%2C630%29%2CregionOfInterest%3D%281034%2C332%29&hash=d7f8092b7a6c2888063fabf1f2c07030b204ed909260478a4c4d64588a16f4ba,,"In der philippinischen Stadt Cebu musste eine Familie die Decke ihres eigenen Hauses durchbrechen, um sich vor dem Super-Taifun ""Kalmaegi"" in Sicherheit zu bringen. Ein Video, das derzeit auf X kursi… [+1089 chars]",,"Philippinische Familie rettet sich über Dach vor Super-Taifun. Ein philippinischer Familienvater musste sein Hausdach einschlagen, um seine Familie vor dem Super-Taifun zu retten. Wenige Tage nach dem ersten Wirbelsturm trifft die Philippinen jetzt die nächste Katastrophe.","Filipino family escapes super typhoon via roof. A Filipino father had to knock down the roof of his house to save his family from the super typhoon. A few days after the first hurricane, the next disaster is now hitting the Philippines.","Filipino familia super typhonium per tectum evadit. Pater Filipino tectum domus suae evertere debuit ad conservandam familiam e super typhonibus. Paucis diebus post primam procellam, altera clades Philippinas nunc ferendi est.",2025-10-21 19:24:47+00:00
e5a623435528fdee3a37c784db2a87b6,2025-11-05T06:05:14Z,'Tropensturm',www.sueddeutsche.de,de,0.9,Südostasien: Taifun hinterlässt Zerstörung auf den Philippinen,"Autos türmen sich, Menschen fliehen auf ihre Dächer: Der Taifun „Kalmaegi“ hat Hunderttausende in die Flucht getrieben. 66 Menschen wurden tot geborgen. Während die Opferzahl steigt, nähert sich schon der nächste Tropensturm.",https://www.sueddeutsche.de/panorama/philippinen-taifun-kalmaegi-zerstoerung-tote-li.3334685,https://www.sueddeutsche.de/2025/11/05/60c21e83-7987-4ef8-bcb4-5e9669430ece.jpg?q=60&fm=webp&width=1200&rect=0%2C131%2C2511%2C1412,,"Der Wirbelsturm hatte zuvor mit orkanartigen Böen, heftigen Regenfällen und meterhohen Flutwellen in dem südostasiatischen Inselstaat gewütet. Mittlerweile hat er sich laut Wetterdienst Pagasa abgesc… [+1310 chars]",,"Südostasien: Taifun hinterlässt Zerstörung auf den Philippinen. Autos türmen sich, Menschen fliehen auf ihre Dächer: Der Taifun „Kalmaegi“ hat Hunderttausende in die Flucht getrieben. 66 Menschen wurden tot geborgen. Während die Opferzahl steigt, nähert sich schon der nächste Tropensturm.","Southeast Asia: Typhoon leaves destruction in the Philippines. Cars are piling up, people are fleeing to their roofs: Typhoon “Kalmaegi” has forced hundreds of thousands of people to flee. 66 people were recovered dead. While the number of victims increases, the next tropical storm is already approaching.","Asiae australis: Typhonis interitum in Philippinis relinquit. Cars struit, homines ad tecta fugiunt: Typhoon ""Kalmaegi"" centena milia hominum fugere coegit. 66 homines mortui sunt. Dum numerus victimarum crescit, altera tropica tempestas iam appropinquat.",2025-11-20 19:24:47+00:00
b41b190d1d85ce0cd1a73e5e015dc706,2025-11-06T02:52:20Z,'Tropensturm',www.tagesspiegel.de,de,0.9,Tropensturm in Südostasien: Zahl der Toten nach Taifun auf den Philippinen steigt,"Autos auf Dächern, ganze Dörfer im Schlamm: Taifun „Kalmaegi“ hinterlässt Chaos auf den Philippinen. Jetzt nähert sich der Sturm „Fung-Wong“ - wird er zum Supertaifun?",https://www.tagesspiegel.de/gesellschaft/panorama/tropensturm-in-sudostasien-zahl-der-toten-nach-taifun-auf-den-philippinen-steigt-14769275.html,https://www.tagesspiegel.de/images/14769272/alternates/BASE_16_9_W1400/1762397540000/taifun-kalmaegi-philippinen.jpeg,,"Auf den Philippinen ist die Zahl der Toten durch den verheerenden Taifun Kalmaegi weiter gestiegen. Mindestens 114 Menschen kamen ums Leben, 127 werden noch vermisst, wie die nationale Katastrophensc… [+2656 chars]",,"Tropensturm in Südostasien: Zahl der Toten nach Taifun auf den Philippinen steigt. Autos auf Dächern, ganze Dörfer im Schlamm: Taifun „Kalmaegi“ hinterlässt Chaos auf den Philippinen. Jetzt nähert sich der Sturm „Fung-Wong“ - wird er zum Supertaifun?","Tropical storm in Southeast Asia: Number of deaths after typhoon in the Philippines increases. Cars on roofs, entire villages in the mud: Typhoon “Kalmaegi” leaves chaos in the Philippines. Now the storm “Fung-Wong” is approaching – will it become a super typhoon?","Tempestas tropica in Asia Australi est: Numerus funerum post typhonium in Philippinis crescit. Cars in tectis, pagi integri in limo: Typhoon ""Kalmaegi"" chaos in Philippinis relinquit. Tempestas iam ""Fung-Wong"" appropinquat - fiet super typhon?",2025-11-20 19:24:47+00:00
8fbd1c2c8427b19cc5ff04b17178c5fd,2025-11-02T19:59:25Z,'Hurrikan',www.stern.de,de,0.9,Zahl der Hurrikan-Toten in Jamaika steigt auf 28,"Die Zahl der Todesopfer des Hurrikans ""Melissa"" auf Jamaika ist auf mindestens 28 gestiegen. Berichte über weitere mögliche Opfer würden derzeit überprüft, erklärte Premierminister Andrew Holness am Samstagabend (Ortszeit) im Onlinedienst X. Insgesamt stieg d…",https://www.stern.de/news/zahl-der-hurrikan-toten-in-jamaika-steigt-auf-28-36182682.html,https://image.stern.de/36182684/t/cF/v1/w1440/r1.7778/-/02--ruine-einer-kirche-im-westen-jamaikas---c6b1c51c85590eef.jpg,,"Kopiere den aktuellen Link
Zur Merkliste hinzufügen
Die Zahl der Todesopfer des Hurrikans ""Melissa"" auf Jamaika ist auf mindestens 28 gestiegen. Berichte über weitere mögliche Opfer würden derzeit … [+910 chars]",,"Zahl der Hurrikan-Toten in Jamaika steigt auf 28. Die Zahl der Todesopfer des Hurrikans ""Melissa"" auf Jamaika ist auf mindestens 28 gestiegen. Berichte über weitere mögliche Opfer würden derzeit überprüft, erklärte Premierminister Andrew Holness am Samstagabend (Ortszeit) im Onlinedienst X. Insgesamt stieg d…","Hurricane death toll in Jamaica rises to 28. The death toll from Hurricane Melissa in Jamaica has risen to at least 28. Reports of further possible victims are currently being checked, Prime Minister Andrew Holness said on Saturday evening (local time) in the online service X. Overall, the...","Turbo mortis in Jamaica surgit 28. mortuorum portorium Hurricane Melissa in Jamaica usque ad minimum 28. Renuntiationes ulterioris possibilium victimarum in praesenti repressae sunt, Primus minister Andrew Holness dixit vespere Sabbati (loci temporis) in servitio online X. Super, in...",2025-11-22 03:12:12+00:00
2472f06f1aa06a9c725548e5c60fdd00,2025-11-04T06:38:51Z,'Taifun',www.zeit.de,de,0.9,Umweltkatasstrophe: Mindestens drei Menschen sterben durch Taifun Kalmaegi auf Philippinen,"Orkanböen, heftiger Regen und meterhohe Flutwellen haben Teile des Inselstaates getroffen. Zwei Menschen ertranken, eine weitere Person wurde von einem Baum erschlagen.",https://www.zeit.de/gesellschaft/2025-11/taifun-kalmaegi-philippinen-zerstoerung,https://img.zeit.de/wissen/umwelt/2025-11/taifun-kalmaegi-philippinen-zerstoerung-bild/wide__1300x731,,"Der Taifun Kalmaegi ist in den vergangenen Stunden über die Philippinen hinweggefegt. Vor allem in den östlichen und zentralen Regionen gab es orkanartige Böen, heftige Regenfälle und meterhohe Flutw… [+739 chars]",,"Umweltkatasstrophe: Mindestens drei Menschen sterben durch Taifun Kalmaegi auf Philippinen. Orkanböen, heftiger Regen und meterhohe Flutwellen haben Teile des Inselstaates getroffen. Zwei Menschen ertranken, eine weitere Person wurde von einem Baum erschlagen.","Environmental disaster: At least three people die from Typhoon Kalmaegi in the Philippines. Hurricane gusts, heavy rain and meter-high tidal waves have hit parts of the island state. Two people drowned and another person was killed by a tree.","Clades environmentalis: Saltem tres homines ex Typhoon Kalmaegi in Philippinis moriuntur. Procellae procellae, pluviae graves et undae metri altae, partes insulae publicae feriunt. Duo homines submersi sunt et alius homo per lignum necatus est.",2025-11-22 19:22:10+00:00
0f7fef792baa707c14300c6027cb9b75,2025-11-05T03:23:18Z,'Taifun',www.zeit.de,de,0.9,Südostasien: Philippinen melden 58 Tote nach Taifun,Der Sturm Kalmaegi hat vor allem die bei Touristen beliebte Region Cebu verwüstet. Sechs Rettungskräfte kamen beim Absturz ihres Hubschraubers ums Leben.,https://www.zeit.de/gesellschaft/zeitgeschehen/2025-11/taifun-kalmaegi-philippinen-cebu-tote,https://img.zeit.de/gesellschaft/zeitgeschehen/2025-11/taifun-kalmaegi-philippinen-cebu-tote-bild/wide__1300x731,,"Auf den
Philippinen sind bei einem Taifun laut Behördenangaben mindestens 58 Menschen getötet worden. Mindestens 13 weitere Menschen werden demnach noch vermisst. Unter den Toten sind den Angaben zu… [+1097 chars]",,Südostasien: Philippinen melden 58 Tote nach Taifun. Der Sturm Kalmaegi hat vor allem die bei Touristen beliebte Region Cebu verwüstet. Sechs Rettungskräfte kamen beim Absturz ihres Hubschraubers ums Leben.,"Southeast Asia: Philippines reports 58 dead after typhoon. The storm Kalmaegi particularly devastated the Cebu region, which is popular with tourists. Six rescue workers died when their helicopter crashed.","Southeast Asia: Philippines refert 58 post typhonem mortuum. Tempestas Kalmaegi praecipue regionem Cebu, quae peregrinatoribus vulgaris est, devastavit. Sex opifices liberandi mortui sunt cum helicopter eorum concrepuit.",2025-11-22 19:22:10+00:00
2a69820471e4a2f093e4cce754953e1d,2025-11-05T11:16:22Z,'Taifun',www.tagesschau.de,de,0.9,"Taifun ""Kalmaegi"": Zahl der Toten auf den Philippinen steigt","Erdrutsche, Überschwemmungen, zerstörte Häuser: Die Zahl der Toten infolge des Taifuns ""Kalmaegi"" auf den Philippinen ist auf 66 gestiegen. Mehrere Menschen werden noch vermisst. Am schwersten betroffen ist die Provinz Cebu.",https://www.tagesschau.de/ausland/asien/philiipinen-taifun-100.html,https://images.tagesschau.de/image/a3fdd345-8231-4cea-9d32-c4230f6119e3/AAABmlNzESQ/AAABmgWmh8Q/16x9-big/taifun-philippinen-178.jpg?width=1280,,"Stand: 05.11.2025 12:16 Uhr
Erdrutsche, Überschwemmungen, zerstörte Häuser: Die Zahl der Toten infolge des Taifuns ""Kalmaegi"" auf den Philippinen ist auf 66 gestiegen. Mehrere Menschen werden noch v… [+2449 chars]",,"Taifun ""Kalmaegi"": Zahl der Toten auf den Philippinen steigt. Erdrutsche, Überschwemmungen, zerstörte Häuser: Die Zahl der Toten infolge des Taifuns ""Kalmaegi"" auf den Philippinen ist auf 66 gestiegen. Mehrere Menschen werden noch vermisst. Am schwersten betroffen ist die Provinz Cebu.","Typhoon ""Kalmaegi"": number of deaths in the Philippines increases. Landslides, floods, destroyed houses: The number of deaths as a result of typhoon ""Kalmaegi"" in the Philippines has risen to 66. Several people are still missing. The province of Cebu is the hardest hit.","Typhoon ""Kalmaegi"": numerus funerum in Philippinis crescit. Prolapsae, inundationes, domuum destructae: Numerus funerum sicut effectus typhon ""Kalmaegi"" in Philippinis orta est 66. Plures adhuc homines desunt. Provincia Cebu durissima est.",2025-11-22 19:22:10+00:00
d0fd9e894595f75811fb715541264732,2025-11-08T10:39:20Z,'Taifun',www.zeit.de,de,0.9,Taifun Kalmaegi: Mehr als 200 Tote durch Taifun auf den Philippinen,Der Taifun Kalmaegi hat auf den Philippinen und in Vietnam schwere Schäden verursacht. Mehr als 200 Menschen kamen ums Leben. Nun droht bereits der nächste Sturm.,https://www.zeit.de/gesellschaft/zeitgeschehen/2025-11/taifun-kalmaegi-philippinen-vietnam-tote,https://img.zeit.de/gesellschaft/2025-11/taifun-kalmaegi-philippinen-vietnam-tote-bild/wide__1300x731,,Der verheerende Taifun Kalmaegi hat auf den Philippinen und in Vietnam schwere Zerstörungen angerichtet. Nach Angaben des philippinischen Katastrophenschutzes ist die Zahl der Toten auf mehr als 200 … [+1436 chars],,Taifun Kalmaegi: Mehr als 200 Tote durch Taifun auf den Philippinen. Der Taifun Kalmaegi hat auf den Philippinen und in Vietnam schwere Schäden verursacht. Mehr als 200 Menschen kamen ums Leben. Nun droht bereits der nächste Sturm.,Typhoon Kalmaegi: More than 200 dead from typhoon in the Philippines. Typhoon Kalmaegi caused severe damage in the Philippines and Vietnam. More than 200 people were killed. Now the next storm is already threatening.,Typhoon Kalmaegi: Plus quam 200 mortui e typhonibus in Philippinis. Typhoon Kalmaegi grave damnum in Philippines et in Vietnam fecit. Plus quam CC homines interfecti sunt. Proxima tempestas iam imminet.,2025-11-22 19:22:10+00:00
d3546df0985b2111d5a288eaf0db0245,2025-11-18T16:10:52Z,'Taifun',www.zeit.de,de,0.9,"Schiffsunglück im Pazifik: ""Eine Welt, in der Waren oft besser versichert sind als Menschen""","Als ein Frachter mit Tausenden Kühen und 43 Seeleuten in einem Taifun untergeht, zeigt sich die dunkle Seite der globalen Schifffahrt. Warum fuhr das Schiff in den Sturm?",https://www.zeit.de/gesellschaft/2025-11/schiffsunglueck-pazifik-viehfrachter-verbrechen-video-podcast,https://img.zeit.de/gesellschaft/2025-11/schiffsunglueck-pazifik-viehfrachter-verbrechen-video-podcast-foto/wide__1300x731,,"Der Viehfrachter ""Gulf Livestock 1"" ist mitten im Pazifik als ein Sturm aufzieht. An Bord befinden sich 6.000 Kühe und 43 Crewmitglieder. Das Schiff fährt geradezu in den Taifun und sinkt. Nur zwei M… [+691 chars]",,"Schiffsunglück im Pazifik: ""Eine Welt, in der Waren oft besser versichert sind als Menschen"". Als ein Frachter mit Tausenden Kühen und 43 Seeleuten in einem Taifun untergeht, zeigt sich die dunkle Seite der globalen Schifffahrt. Warum fuhr das Schiff in den Sturm?","Shipwreck in the Pacific: ""A world in which goods are often better insured than people"". When a freighter carrying thousands of cows and 43 sailors sinks in a typhoon, the dark side of global shipping is revealed. Why did the ship sail into the storm?","Naufragium in Pacifico: ""Mundus in quo bona saepe melius quam homines reddebant"". Cum navis oneraria mille boum et 43 nautarum in typhonium deprimat, tenebrosa pars navium globalis manifestatur. Cur navis in tempestate navigavit?",2025-11-22 19:22:10+00:00
eb4797c71a56c52b3ac23ba084871e24,2025-11-10T09:42:45Z,'Taifun',www.stern.de,de,0.9,Taifun legt an Strand in Vietnam jahrhundertealtes Schiffswrack frei,"An einem Strand in Vietnam hat der Taifun ""Kalmaegi"" ein jahrhundertealtes Schiffswrack freigelegt. Die gut erhaltenen Überreste des mehr als 17 Meter langen Holzschiffs waren erstmals 2023 an der Küste der Stadt Hoi An entdeckt, aber rasch wieder überflutet …",https://www.stern.de/news/taifun-legt-an-strand-in-vietnam-jahrhundertealtes-schiffswrack-frei-36301052.html,https://image.stern.de/36301054/t/wQ/v1/w1440/r1.7778/-/10--das-in-hoi-an-aus-dem-sand-ragende-schiffswrack---5404c06257d1e318.jpg,,"Kopiere den aktuellen Link
Zur Merkliste hinzufügen
An einem Strand in Vietnam hat der Taifun ""Kalmaegi"" ein jahrhundertealtes Schiffswrack freigelegt. Die gut erhaltenen Überreste des mehr als 17 … [+1490 chars]",,"Taifun legt an Strand in Vietnam jahrhundertealtes Schiffswrack frei. An einem Strand in Vietnam hat der Taifun ""Kalmaegi"" ein jahrhundertealtes Schiffswrack freigelegt. Die gut erhaltenen Überreste des mehr als 17 Meter langen Holzschiffs waren erstmals 2023 an der Küste der Stadt Hoi An entdeckt, aber rasch wieder überflutet …","Typhoon uncovers century-old shipwreck on beach in Vietnam. Typhoon Kalmaegi uncovered a centuries-old shipwreck on a beach in Vietnam. The well-preserved remains of the more than 17 meter long wooden ship were first discovered on the coast of the city of Hoi An in 2023, but were quickly flooded again...","Typhoon aperit vetus naufragium in litore in Vietnam. Typhoon Kalmaegi perantiqua naufragium in Vietnam in litore detexit. Reliquiae bene conservatae plus quam XVII metrorum longae navis ligneae primum in ora urbis Hoi An anno 2023 repertae sunt, sed celeriter iterum inundatae sunt.",2025-11-24 19:22:59+00:00
2e49b3c5aa8fb9308a4d666ab0dda5ef,2025-11-10T10:25:00Z,'Taifun',www.dw.com,de,0.9,"Taifun ""Fung-Wong"" legt Teile der Philippinen lahm","Der mittlerweile abgeschwächte Taifun ""Fung-Wong"" ist von den Philippinen abgezogen. Er hat dort eine Spur der Verwüstung hinterlassen. Mindestens zwei Menschen kamen ums Leben.",https://www.dw.com/de/taifun-fung-wong-legt-teile-der-philippinen-lahm/a-74684397,https://static.dw.com/image/74682173_6.jpg,,"Der heftige Taifun ""Fung-Wong"" hat auf den nördlichen Philippinen mit Starkregen und Sturmböen gewütet. Dennoch kam der Inselstaat dank Vorsichtsmaßnahmen glimpflicher davon als zunächst befürchtet.… [+2038 chars]",,"Taifun ""Fung-Wong"" legt Teile der Philippinen lahm. Der mittlerweile abgeschwächte Taifun ""Fung-Wong"" ist von den Philippinen abgezogen. Er hat dort eine Spur der Verwüstung hinterlassen. Mindestens zwei Menschen kamen ums Leben.",Typhoon “Fung-Wong” paralyzes parts of the Philippines. The now weakened typhoon “Fung-Wong” has moved away from the Philippines. He left a trail of destruction there. At least two people were killed.,"Typhoon ""Fung-Wong"" partes Philippinarum torpescit. Nunc typhon ""Fung-Wong"" debilitatus a Philippinis discessit. vestigia exitii ibi reliquit. Saltem duo homines interfecti sunt.",2025-11-24 19:22:59+00:00
04185cd003e7d39251df14e58bb10c23,2025-11-10T10:28:18Z,'Taifun',www.n-tv.de,de,0.9,An Strand in Vietnam: Taifun legt jahrhundertealtes Schiffswrack frei,Bereits 2023 wird ein Schiffswrack an einem Strand in Vietnam kurzzeitig sichtbar. Jetzt legt ein Taifun das jahrhundertalte Gefährt endgültig frei. Experten raten nun zu schnellem Handeln.,https://www.n-tv.de/panorama/Taifun-legt-jahrhundertealtes-Schiffswrack-frei-id30001712.html,https://www.n-tv.de/img/30001596/1762772028/Img_16_9/1200/Das-Schiff-ist-17-Meter-lang.jpg,,"Das Schiff ist 17 Meter lang. (Foto: AFP)
Bereits 2023 wird ein Schiffswrack an einem Strand in Vietnam kurzzeitig sichtbar. Jetzt legt ein Taifun das jahrhundertalte Gefährt endgültig frei. Experte… [+1699 chars]",,An Strand in Vietnam: Taifun legt jahrhundertealtes Schiffswrack frei. Bereits 2023 wird ein Schiffswrack an einem Strand in Vietnam kurzzeitig sichtbar. Jetzt legt ein Taifun das jahrhundertalte Gefährt endgültig frei. Experten raten nun zu schnellem Handeln.,"On the beach in Vietnam: Typhoon uncovers centuries-old shipwreck. As early as 2023, a shipwreck will be briefly visible on a beach in Vietnam. Now a typhoon finally exposes the century-old vehicle. Experts now recommend acting quickly.","In litore in Vietnam: Typhon naufragium perantiqua retegit. Cum primum 2023, breviter naufragium in Vietnam in litore conspicietur. Nunc typhona tandem vehiculum saeculum vetus exponit. Periti nunc cito agentes commendamus.",2025-11-24 19:22:59+00:00
84c17bc6bb2c7af02567a6be523a3b1a,2025-11-10T11:48:10Z,'Taifun',www.stern.de,de,0.9,"Mindestens fünf Tote durch Taifun ""Fung-wong"" auf den Philippinen","Schon wieder hat ein Taifun den Philippinen Tod und Zerstörung gebracht: Nur wenige Tage nach dem Durchzug von ""Kalmaegi"" starben nach Angaben der Behörden mindestens fünf Menschen durch den Taifun ""Fung-wong"". Ganze Ortschaften standen am Montag unter Wasser…",https://www.stern.de/news/mindestens-fuenf-tote-durch-taifun--fung-wong--auf-den-philippinen-36298230.html,https://image.stern.de/36304130/t/VZ/v1/w1440/r1.7778/-/10--ueberflutete-haeuser-in-der-stadt-tuguegarao---a2faabe679143e9f.jpg,,"Kopiere den aktuellen Link
Zur Merkliste hinzufügen
Schon wieder hat ein Taifun den Philippinen Tod und Zerstörung gebracht: Nur wenige Tage nach dem Durchzug von ""Kalmaegi"" starben nach Angaben de… [+3391 chars]",,"Mindestens fünf Tote durch Taifun ""Fung-wong"" auf den Philippinen. Schon wieder hat ein Taifun den Philippinen Tod und Zerstörung gebracht: Nur wenige Tage nach dem Durchzug von ""Kalmaegi"" starben nach Angaben der Behörden mindestens fünf Menschen durch den Taifun ""Fung-wong"". Ganze Ortschaften standen am Montag unter Wasser…","At least five dead from Typhoon “Fung-wong” in the Philippines. Another typhoon has brought death and destruction to the Philippines: just a few days after ""Kalmaegi"" passed through, at least five people died in typhoon ""Fung-wong"", according to the authorities. Entire towns were under water on Monday...","Saltem quinque mortui e Typhoone ""Fung-wong"" in Philippinis. Alius typhoon mortem et perniciem Philippinis attulit: paucis post diebus ""Kalmaegi"" transiit, quinque saltem homines in typhon ""Fung-wong"" mortui sunt, secundum auctoritates. Tota oppida sub aqua die Lunae...",2025-11-24 19:22:59+00:00
6de1317b3d6594acf921917b7b37c870,2025-11-10T12:32:30Z,'Taifun',www.stern.de,de,0.9,Spur der Verwüstung,"Auf den Philippinen sitzt eine Frau vor ihrem Haus, nachdem aufgrund heftiger Regenfälle durch den Taifun ""Fung-wong"" ein naher Fluss über die Ufer getreten war. Vor wenigen Tagen hatte bereits der Taifun ""Kalmaegi"" in dem Inselstaat gewütet.",https://www.stern.de/news/spur-der-verwuestung-36305412.html,https://image.stern.de/36305414/t/J_/v1/w1440/r1.7778/-/10--spur-der-verwuestung---227cdbb4dff7b27d.jpg,,"Zugang zu stern+statt 11,96 
 nur 1  
<ul><li>Alles von stern+ mit erstklassigen Inhalten von GEO und Capital</li><li>4 Wochen testen, dann 2,99  je Woche</li><li>jederzeit kündbar</li></ul>",,"Spur der Verwüstung. Auf den Philippinen sitzt eine Frau vor ihrem Haus, nachdem aufgrund heftiger Regenfälle durch den Taifun ""Fung-wong"" ein naher Fluss über die Ufer getreten war. Vor wenigen Tagen hatte bereits der Taifun ""Kalmaegi"" in dem Inselstaat gewütet.","Trail of devastation. In the Philippines, a woman sits in front of her house after a nearby river burst its banks due to heavy rain caused by Typhoon Fung-wong. A few days ago, typhoon “Kalmaegi” raged in the island state.","Trahentium vastitas. In Philippinis mulier ante domum suam sedet postquam prope flumen ripas suas erupit ob pluviam Typhonis Fung-wong causatam. Typhoon ""Kalmaegi"" in statu insulae saeviit paucis abhinc diebus.",2025-11-24 19:22:59+00:00
