index,published,keyword,domain,language,valid,title,description,url,image,archive,content,quote,de,en,la,added
35a9d219c1862d8ffcb047fe4e849d57,2025-12-02T04:00:45Z,'Taifun',www.stern.de,de,0.9,Unwetter: Wirbelsturmsaison endet glimpflich - USA und Japan verschont,"Die Anwohner von Nordatlantik und westlichem Pazifik hatten Glück: Die diesjährige Wirbelsturmsaison richtete vergleichsweise geringe Schäden an, trotz schwerer Stürme.",https://www.stern.de/wirtschaft/news/unwetter--wirbelsturmsaison-endet-glimpflich---usa-und-japan-verschont-36917716.html,https://image.stern.de/36917718/t/uD/v1/w1440/r1.7778/-/02--jpdhofushzv26axs2048jpeg---824cf25e9028e74c.jpg,,"Kopiere den aktuellen Link
Zur Merkliste hinzufügen
Die Anwohner von Nordatlantik und westlichem Pazifik hatten Glück: Die diesjährige Wirbelsturmsaison richtete vergleichsweise geringe Schäden an,… [+3609 chars]",,"Unwetter: Wirbelsturmsaison endet glimpflich - USA und Japan verschont. Die Anwohner von Nordatlantik und westlichem Pazifik hatten Glück: Die diesjährige Wirbelsturmsaison richtete vergleichsweise geringe Schäden an, trotz schwerer Stürme.","Severe weather: Hurricane season ends lightly - USA and Japan spared. The residents of the North Atlantic and western Pacific were lucky: This year's hurricane season caused comparatively little damage, despite severe storms.","Tempestas gravis: Tempus Hurricane leviter terminatur - USA et Iaponia pepercit. Incolas Atlantici Septentrionalis et Pacifici occidentalis fortunati fuerunt: Tempus huius anni turbinum comparative modicum detrimentum attulit, licet gravibus procellis.",2025-12-03 07:31:26+00:00
883e096a9aeeff42975a7eff2df19632,2025-12-02T04:00:45Z,'Hurrikan Ozean',www.zeit.de,de,0.9,Unwetter: Wirbelsturmsaison endet glimpflich - USA und Japan verschont,Hier finden Sie Informationen zu dem Thema „Unwetter“. Lesen Sie jetzt „Wirbelsturmsaison endet glimpflich - USA und Japan verschont“.,https://www.zeit.de/news/2025-12/02/wirbelsturmsaison-endet-glimpflich-usa-und-japan-verschont,https://img.zeit.de/news/2025-12/02/wirbelsturmsaison-endet-glimpflich-usa-und-japan-verschont-image-group/wide__1300x731,,"Die diesjährige Wirbelsturmsaison hat in den USA, der Karibik und Ostasien trotz mehrerer potenziell verheerender Stürme nur einen Bruchteil der üblichen Schäden angerichtet. Der Rückversicherer Muni… [+3147 chars]",,Unwetter: Wirbelsturmsaison endet glimpflich - USA und Japan verschont. Hier finden Sie Informationen zu dem Thema „Unwetter“. Lesen Sie jetzt „Wirbelsturmsaison endet glimpflich - USA und Japan verschont“.,Severe weather: Hurricane season ends lightly - USA and Japan spared. Here you will find information on the topic of “storms”. Now read “Cyclone season ends lightly – USA and Japan spared”.,"Tempestas gravis: Tempus Hurricane leviter terminatur - USA et Iaponia pepercit. Hic informationes invenies in argumento ""procellae"". Nunc lege “Cyclone temporum leviter terminata – USA et Iaponia pepercit”.",2025-12-04 13:44:03+00:00
416eee718695948f9ac3f28f29f23110,2025-12-02T04:02:17Z,'Hurrikan Ozean',www.tagesspiegel.de,de,0.9,Unwetter: Wirbelsturmsaison endet glimpflich - USA und Japan verschont,"Die Anwohner von Nordatlantik und westlichem Pazifik hatten Glück: Die diesjährige Wirbelsturmsaison richtete vergleichsweise geringe Schäden an, trotz schwerer Stürme.",https://www.tagesspiegel.de/wirtschaft/unwetter-wirbelsturmsaison-endet-glimpflich-usa-und-japan-verschont-15003801.html,,,"Die diesjährige Wirbelsturmsaison hat in den USA, der Karibik und Ostasien trotz mehrerer potenziell verheerender Stürme nur einen Bruchteil der üblichen Schäden angerichtet. Der Rückversicherer Muni… [+3203 chars]",,"Unwetter: Wirbelsturmsaison endet glimpflich - USA und Japan verschont. Die Anwohner von Nordatlantik und westlichem Pazifik hatten Glück: Die diesjährige Wirbelsturmsaison richtete vergleichsweise geringe Schäden an, trotz schwerer Stürme.","Severe weather: Hurricane season ends lightly - USA and Japan spared. The residents of the North Atlantic and western Pacific were lucky: This year's hurricane season caused comparatively little damage, despite severe storms.","Tempestas gravis: Tempus Hurricane leviter terminatur - USA et Iaponia pepercit. Incolas Atlantici Septentrionalis et Pacifici occidentalis fortunati fuerunt: Tempus huius anni turbinum comparative modicum detrimentum attulit, licet gravibus procellis.",2025-12-04 13:44:03+00:00
d0addcdc7fb56a6d08bfd67b565ddf74,2025-12-01T15:01:45Z,'Tropensturm',www.zeit.de,de,0.9,Tropensturm: Zahl der Toten nach Zyklon in Südostasien steigt auf fast 800,Nach einem seltenen Tropensturm sind vor allem in Indonesien viele Menschen gestorben. Auch in Sri Lanka werden noch Hunderte Menschen vermisst.,https://www.zeit.de/gesellschaft/2025-12/tropensturm-suedostasien-zyklon-malakka-indonesien,https://img.zeit.de/gesellschaft/2025-12/sturzflut-in-indonesien-bild/wide__1300x731,,"In Südostasien sind bei Überschwemmungen und Erdrutschen nach einem Zyklon fast 800 Menschen ums Leben gekommen. Allein in Indonesien stieg die Zahl der Toten offiziellen Angaben zufolge auf 604, zud… [+1641 chars]",,Tropensturm: Zahl der Toten nach Zyklon in Südostasien steigt auf fast 800. Nach einem seltenen Tropensturm sind vor allem in Indonesien viele Menschen gestorben. Auch in Sri Lanka werden noch Hunderte Menschen vermisst.,"Tropical storm: Number of deaths after cyclone in Southeast Asia rises to almost 800. Many people died after a rare tropical storm, especially in Indonesia. Hundreds of people are still missing in Sri Lanka.","Tempestas tropica: Numerus funerum post cyclum in Asia Meridiana oritur usque ad fere 800. Multi homines post raram tropicam tempestatem mortui sunt, praesertim in Indonesia. Centum hominum adhuc in Sri Lanka desunt.",2025-12-04 19:27:33+00:00
b8691a89488b4a65e1fbf64afc2ddbad,2025-12-03T12:47:35Z,'Tropensturm',www.zeit.de,de,0.9,Tropensturm: Mehr als 1.400 Tote nach Überschwemmungen in Südostasien,Mit dem Zyklon Ditwah erlebt Indonesien die schlimmste Umweltkatastrophe seit dem Tsunami auf Sulawesi 2018. Auch Sri Lanka und Thailand sind schwer betroffen.,https://www.zeit.de/gesellschaft/zeitgeschehen/2025-12/suedostasien-indonesien-sri-lanka-hochwasser-zyklon,https://img.zeit.de/gesellschaft/2025-12/suedostasien-indonesien-sri-lanka-hochwasser-zyklon-bild/wide__1300x731,,In Südostasien sind nach den schweren Überschwemmungen mehr als 1.400 Leichen gefunden worden. Allein in Indonesien meldeten die Behörden 753 Tote und bezeichneten die Zerstörung durch die unerbittli… [+789 chars],,Tropensturm: Mehr als 1.400 Tote nach Überschwemmungen in Südostasien. Mit dem Zyklon Ditwah erlebt Indonesien die schlimmste Umweltkatastrophe seit dem Tsunami auf Sulawesi 2018. Auch Sri Lanka und Thailand sind schwer betroffen.,"Tropical storm: More than 1,400 dead after floods in Southeast Asia. With Cyclone Ditwah, Indonesia is experiencing the worst environmental disaster since the tsunami on Sulawesi in 2018. Sri Lanka and Thailand are also badly affected.","Tempestas tropica: Plus quam 1,400 mortuus est post diluvia in Asia Meridiana. Cum Cyclone Ditwah, Indonesia pessimam calamitatem environmental experitur cum tsunami in Sulawesi anno 2018. Sri Lanka et Thailandia etiam male affecti sunt.",2025-12-04 19:27:33+00:00
15091a5373ab3372b54482ccbfb2e5f0,2025-12-05T03:42:52Z,'Tropensturm',www.zeit.de,de,0.9,Tropensturm: Zahl der Toten nach Sturm in Asien steigt auf mehr als 1.500,Bei Überschwemmungen sind vor allem in Indonesien und Sri Lanka viele Menschen getötet worden. Umweltschützer machen Abholzungen für die Katastrophe mitverantwortlich.,https://www.zeit.de/gesellschaft/2025-12/tropensturm-ueberschwemmungen-asien-indonesien-sri-lanka-tote-1500,https://img.zeit.de/gesellschaft/2025-12/tropensturm-ueberschwemmungen-asien-indonesien-sri-lanka-tote-1500-bild/wide__1300x731,,"Im Süden und Südosten Asiens sind bei Überschwemmungen und
Erdrutschen nach einem Tropensturm mehr als 1.500 Menschen getötet worden. Behörden in Indonesien meldeten mindestens 836 Tote. In Sri Lank… [+1168 chars]",,Tropensturm: Zahl der Toten nach Sturm in Asien steigt auf mehr als 1.500. Bei Überschwemmungen sind vor allem in Indonesien und Sri Lanka viele Menschen getötet worden. Umweltschützer machen Abholzungen für die Katastrophe mitverantwortlich.,"Tropical storm: Number of deaths after storm in Asia rises to more than 1,500. Many people have been killed in floods, especially in Indonesia and Sri Lanka. Environmentalists blame deforestation for the disaster.","Tempestas tropica: Numerus funerum post tempestatem in Asia oritur ad plus quam 1.500. Multi homines in inundationibus interfecti sunt, praesertim in Indonesia et Sri Lanka. Environmentalists deforestationem calamitatis reprehendunt.",2025-12-08 07:33:11+00:00
e20b97edfe80a6bf061484ca523d0506,2025-12-06T16:35:35Z,'Tropensturm',orf.at,de,0.9,Seuchengefahr nach Flut auf Sumatra,"Mehr als eine Woche nach dem Tropensturm „Senyar“ ist die Lage auf der indonesischen Insel Sumatra äußerst kritisch. Die Zahl der Todesopfer ist inzwischen auf zumindest 880 gestiegen, Hunderte Menschen werden noch vermisst. Hilfe erreicht das Katastrophengeb…",https://orf.at/stories/3413654/,https://ibs.orf.at/news?image=https%3A%2F%2Fassets.orf.at%2Fmims%2F2025%2F49%2F05%2Fcrops%2Fw%3D1200%2Ch%3D630%2Cq%3D75%2F2858813_master_1104005_sumatra_ueberschwemmungen_seuchengefahr_afp.jpg%3Fs%3Da599c7e8cd54ba8746c799035d18febd48659fd3,,"Betroffen sind weitgehend drei Provinzen, neben Aceh im Nordwesten auch Nord- und Westsumatra (Sumatra Utara und Sumatra Barat). Dort nehmen Fälle von Fieber, Typhus und Hautinfektionen stark zu, ber… [+4210 chars]",,"Seuchengefahr nach Flut auf Sumatra. Mehr als eine Woche nach dem Tropensturm „Senyar“ ist die Lage auf der indonesischen Insel Sumatra äußerst kritisch. Die Zahl der Todesopfer ist inzwischen auf zumindest 880 gestiegen, Hunderte Menschen werden noch vermisst. Hilfe erreicht das Katastrophengeb…","Danger of epidemic after flood in Sumatra. More than a week after tropical storm “Senyar”, the situation on the Indonesian island of Sumatra is extremely critical. The death toll has now risen to at least 880, and hundreds of people are still missing. Help reaches the disaster area...","Periculum pestilentiae post diluvium in Sumatra. Plus quam septimana post tempestatem tropicam ""Senyar"" res in insula Sumatra Indonesiaca valde critica est. Thelonei mortis iam ad minimum 880 orta sunt, et centeni homines adhuc desunt. Auxilium ad calamitatem regio...",2025-12-08 07:33:11+00:00
