index,published,keyword,domain,language,valid,title,description,url,image,archive,content,quote,de,en,la,added
063d39f8d65547bad7ae17635695ad21,2025-11-09T05:15:28Z,'Taifun',www.tagesspiegel.de,de,0.9,Wirbelsturm „Fung-Wong“: Nächster Taifun auf Philippinen - Hunderttausende evakuiert,"Gerade erst riss der verheerende Taifun „Kalmaegi“ Hunderte Menschen in den Tod, jetzt zieht ein neuer Tropensturm über die Philippinen. Der Inselstaat und seine Bewohner wappnen sich.",https://www.tagesspiegel.de/gesellschaft/panorama/wirbelsturm-fung-wong-nachster-taifun-auf-philippinen-hunderttausende-evakuiert-14790554.html,https://www.tagesspiegel.de/images/14790557/alternates/BASE_16_9_W1400/1762666159000/taifun-fung-wong-philippinen.jpeg,,Auf der Flucht vor Supertaifun Fung-Wong haben fast eine Million Bewohner der Philippinen ihre Häuser verlassen müssen. Der heftige Tropensturm zog am Morgen (Ortszeit) mit anhaltenden Windgeschwindi… [+1864 chars],,"Wirbelsturm „Fung-Wong“: Nächster Taifun auf Philippinen - Hunderttausende evakuiert. Gerade erst riss der verheerende Taifun „Kalmaegi“ Hunderte Menschen in den Tod, jetzt zieht ein neuer Tropensturm über die Philippinen. Der Inselstaat und seine Bewohner wappnen sich.","Cyclone “Fung-Wong”: Next typhoon hits the Philippines - hundreds of thousands evacuated. The devastating typhoon “Kalmaegi” just killed hundreds of people, and now a new tropical storm is hitting the Philippines. The island state and its residents are arming themselves.","Cyclone ""Fung-Wong"": Proxima typhon ferit Philippinas - centena milia evacuefacta sunt. Depopulans typhon ""Kalmaegi"" modo centena hominum occidit, et nunc nova tempestas tropica ferit Philippinas. Insulae eius incolas civitatis et arma capiunt.",2025-10-21 19:24:47+00:00
8d42b123e94734205d37c1f23724a183,2025-11-09T07:05:00Z,'Taifun',www.dw.com,de,0.9,"Supertaifun ""Fung-Wong"": Massenevakuierung auf Philippinen","Gerade erst kostete der Sturm ""Kalmaegi"" vielen Menschen das Leben. Nun müssen sich Hunderttausende Philippiner vor einem noch heftigeren Taifun in Sicherheit bringen.",https://www.dw.com/de/philippinen-supertaifun-taifun-fung-wong-massenevakuierung-kalmaegi/a-74676754,https://static.dw.com/image/74676753_6.jpg,,"Angesichts des Supertaifuns ""Fung-Wong"" haben fast eine Million Bewohner der Philippinen ihre Häuser verlassen müssen. Das bestätigte die nationale Katastrophenschutzbehörde. Der heftige Tropensturm … [+1318 chars]",,"Supertaifun ""Fung-Wong"": Massenevakuierung auf Philippinen. Gerade erst kostete der Sturm ""Kalmaegi"" vielen Menschen das Leben. Nun müssen sich Hunderttausende Philippiner vor einem noch heftigeren Taifun in Sicherheit bringen.",Super typhoon “Fung-Wong”: mass evacuation in the Philippines. The storm “Kalmaegi” has just cost many people their lives. Now hundreds of thousands of Filipinos have to flee to safety from an even more violent typhoon.,"Super typhon ""Fung-Wong"": massa evacuatio in Philippinis. Procella ""Kalmaegi"" modo multis vitam suam constant. Nunc centena milia Filipinos fugiant ut ex typhono violentiore etiam fugiant.",2025-10-21 19:24:47+00:00
adc910c91c7bdd075894e1d24ef1012a,2025-11-09T07:18:22Z,'Taifun',www.tagesspiegel.de,de,0.9,Supertaifun „Fung-Wong“: Fast eine Million Menschen auf den Philippinen evakuiert,"Der verheerende Taifun „Kalmaegi“ kostete gerade erst Hunderte Menschen das Leben, da zieht schon wieder ein neuer Tropensturm über die Philippinen. Und „Fung Wong“ hat noch mehr Wucht.",https://www.tagesspiegel.de/gesellschaft/panorama/supertaifun-fung-wong-fast-eine-million-menschen-auf-den-philippinen-evakuiert-14790614.html,https://www.tagesspiegel.de/images/14790611/alternates/BASE_16_9_W1400/1762672702000/taifun-fung-wong-philippinen.jpeg,,Auf der Flucht vor Supertaifun Fung-Wong haben fast eine Million Bewohner der Philippinen ihre Häuser verlassen müssen. Der heftige Tropensturm zog am Morgen (Ortszeit) mit anhaltenden Windgeschwindi… [+2237 chars],,"Supertaifun „Fung-Wong“: Fast eine Million Menschen auf den Philippinen evakuiert. Der verheerende Taifun „Kalmaegi“ kostete gerade erst Hunderte Menschen das Leben, da zieht schon wieder ein neuer Tropensturm über die Philippinen. Und „Fung Wong“ hat noch mehr Wucht.","Super typhoon “Fung-Wong”: Almost a million people evacuated in the Philippines. The devastating typhoon “Kalmaegi” has just killed hundreds of people, and yet another tropical storm is hitting the Philippines. And “Fung Wong” has even more power.","Eximius typhon ""Fung-Wong"": Fere decies centena millia hominum in Philippinis cessere. Depopulans typhon ""Kalmaegi"" modo centena hominum occidit, et tamen alia tempestas tropica ferit Philippinas. Et ""Fung Wong"" etiam plus valet.",2025-10-21 19:24:47+00:00
c7fea830991599478e85169fccdaa7d3,2025-11-09T07:40:28Z,'Tropensturm',www.n-tv.de,de,0.9,"Nächster Tropensturm wütet: Menschen auf Philippinen flüchten vor Supertaifun ""Fung-Wong""","Vor wenigen Tagen werden die Philippinen von einem Taifun verwüstet. Dabei sterben Hunderte Menschen. Der nächste Supertaifun wird erwartet. Er soll noch heftiger sein. Vor Ort versuchen viele, sich in Sicherheit zu bringen.",https://www.n-tv.de/panorama/Menschen-auf-Philippinen-fluechten-vor-Supertaifun-Fung-Wong-article26149967.html,https://www.n-tv.de/img/incoming/crop26149962/4401324511-cImg_16_9-w1200/2025-11-06T234812Z-1649864685-RC2WQHABGI3Q-RTRMADP-3-ASIA-WEATHER-PHILIPPINES.jpg,,"Vor wenigen Tagen werden die Philippinen von einem Taifun verwüstet. Dabei sterben Hunderte Menschen. Der nächste Supertaifun wird erwartet. Er soll noch heftiger sein. Vor Ort versuchen viele, sich … [+1909 chars]",,"Nächster Tropensturm wütet: Menschen auf Philippinen flüchten vor Supertaifun ""Fung-Wong"". Vor wenigen Tagen werden die Philippinen von einem Taifun verwüstet. Dabei sterben Hunderte Menschen. Der nächste Supertaifun wird erwartet. Er soll noch heftiger sein. Vor Ort versuchen viele, sich in Sicherheit zu bringen.",Next tropical storm rages: People in the Philippines are fleeing super typhoon “Fung-Wong”. A few days ago the Philippines was devastated by a typhoon. Hundreds of people die as a result. The next super typhoon is expected. He should be even more violent. Many people are trying to get to safety on site.,"Postera tempestas tropica furit: Homines in Philippinis fugientes super typhon ""Fung-Wong"". Paucis abhinc diebus a typhonne Philippinae devastatae sunt. Centum hominum quasi moriuntur. Proximum super typhonium expectatur. Debet esse vehementius. Multi homines salutem in situ obtinere conantur.",2025-10-21 19:24:47+00:00
7aa653e54ddf2e37dab8f8a3ea4432f7,2025-11-09T07:58:46Z,'Wirbelsturm',www.faz.net,de,0.9,Tote und Hunderte Verletzte: Tornado wütet im Süden Brasiliens – „Es ist ein Kriegsschauplatz“,"Der Wirbelsturm verwüstet innerhalb von wenigen Minuten die Kleinstadt Rio Bonito do Iguaçu. Sie ist fast vollständig zerstört. Mehrere Menschen sterben, rund 750 werden verletzt.",https://www.faz.net/aktuell/gesellschaft/ungluecke/tornado-in-brasilien-mindestens-sechs-tote-und-hunderte-verletzte-accg-110771904.html,https://media0.faz.net/ppmedia/w1200/aktuell/gesellschaft/342942926/1.10771906/facebook_teaser/dieses-von-der-regierung-des.jpg.webp,,"Bei einem Tornado im Süden Brasiliens sind nach Behördenangaben mindestens sechs Menschen ums Leben gekommen und rund 750 weitere verletzt worden. Mehr als 1.000 Menschen verloren ihr Zuhause, wie da… [+2283 chars]",,"Tote und Hunderte Verletzte: Tornado wütet im Süden Brasiliens – „Es ist ein Kriegsschauplatz“. Der Wirbelsturm verwüstet innerhalb von wenigen Minuten die Kleinstadt Rio Bonito do Iguaçu. Sie ist fast vollständig zerstört. Mehrere Menschen sterben, rund 750 werden verletzt.",Dead and hundreds injured: Tornado rages in southern Brazil – “It is a theater of war”. The hurricane devastated the small town of Rio Bonito do Iguaçu within a few minutes. It is almost completely destroyed. Several people die and around 750 are injured.,Mortui et centeni laesi: Turbo in Brasilia australi saevit – “Theatrum belli est”. Turbo oppidum parvum Rio Bonito do Iguaçu paucis momentis devastavit. Fere omnino deperdita est. Plures homines moriuntur et circiter 750 laeduntur.,2025-10-21 19:24:47+00:00
f89d093df00aa3f13b2d7fcb1ab7190e,2025-11-09T08:39:45Z,'Hurrikan',www.sueddeutsche.de,de,0.9,Wirbelsturm „Melissa“: Urlaub auf Jamaika? Das müssen Reisende jetzt wissen,"Nach dem verheerenden Hurrikan kommt es auf der Karibikinsel zu Überfällen. Das Auswärtige Amt rät von nicht notwendigen Reisen ab. Doch was ist, wenn man längst gebucht hat?",https://www.sueddeutsche.de/wirtschaft/jamaika-reisen-wirbelsturm-infos-touristen-li.3335367,https://www.sueddeutsche.de/2025/10/28/9c8aa9f2-2008-451a-a98b-e89eeb98cce7.jpg?q=60&fm=webp&width=1200&rect=0%2C207%2C3977%2C2237,,"Tausende Touristen, darunter auch eine dreistellige Zahl an Deutschen, haben das Land mittlerweile verlassen. Wie viele Reisende noch dort sind, ist nicht bekannt. Der Sturm verwüstete die Insel nur … [+5095 chars]",,"Wirbelsturm „Melissa“: Urlaub auf Jamaika? Das müssen Reisende jetzt wissen. Nach dem verheerenden Hurrikan kommt es auf der Karibikinsel zu Überfällen. Das Auswärtige Amt rät von nicht notwendigen Reisen ab. Doch was ist, wenn man längst gebucht hat?","Hurricane Melissa: Vacation in Jamaica? This is what travelers need to know now. After the devastating hurricane, there are attacks on the Caribbean island. The Foreign Office advises against unnecessary travel. But what if you have already booked?",Procellae Melissa: Vacation in Jamaica? Hoc est quod viatores nunc scire opus est. Post vastitatem turbinis in insula Caribica oppugnantur. Externorum officium contra necessariam peregrinationem suadet. Sed quid si iam corruptela?,2025-10-21 19:24:47+00:00
b63812f7d05fb0ae83c752952864e7e8,2025-11-09T08:56:35Z,'Taifun',orf.at,de,0.9,Philippinen: Eine Mio. Menschen fliehen vor Taifun „Fung-wong“,,https://orf.at/stories/3410988/,https://orf.at/mojo/1_4_1/storyserver//news/common/images/og-fallback-news.png,,"Fast eine Million Menschen sind am Wochenendeauf den Philippinen vor dem heranrückenden Supertaifun Fung-wong geflohen. Landesweit seien 916.863 Menschen in Sicherheit gebracht worden, erklärte der s… [+779 chars]",,Philippinen: Eine Mio. Menschen fliehen vor Taifun „Fung-wong“. nan,Philippines: One million people flee typhoon “Fung-wong”. nan,"Philippinae: Una miliones hominum typhon ""Fung-wong"" fugiunt. nan",2025-10-21 19:24:47+00:00
ab1c74f9724d7d457d370b255bb04240,2025-11-09T09:00:48Z,'Wirbelsturm',www.stern.de,de,0.9,Paraná: Mehrere Tote und über 700 Verletzte durch Tornado in Brasilien,"Der Wirbelsturm hatte am Freitag innerhalb von Minuten weite Teile der Kleinstadt Rio Bonito do Iguaçu verwüstet. Mindestens sechs Personen starben, hunderte wurden verletzt.",https://www.stern.de/panorama/weltgeschehen/brasilien--mehrere-tote-und-ueber-700-verletzte-durch-tornado-36267066.html,https://image.stern.de/36267266/t/Vi/v1/w1440/r1.7778/-/tornado-in-brasilien--1-.jpg,,"Kopiere den aktuellen Link
Zur Merkliste hinzufügen
Der Wirbelsturm hatte am Freitag innerhalb von Minuten weite Teile der Kleinstadt Rio Bonito do Iguaçu verwüstet. Mindestens sechs Personen starb… [+1950 chars]",,"Paraná: Mehrere Tote und über 700 Verletzte durch Tornado in Brasilien. Der Wirbelsturm hatte am Freitag innerhalb von Minuten weite Teile der Kleinstadt Rio Bonito do Iguaçu verwüstet. Mindestens sechs Personen starben, hunderte wurden verletzt.",Paraná: Several dead and over 700 injured by tornado in Brazil. The cyclone devastated large parts of the small town of Rio Bonito do Iguaçu within minutes on Friday. At least six people died and hundreds were injured.,Paraná: Plures mortui et supra 700 turbo in Brasilia laesi sunt. Cyclonus magnas partes parvi oppidi Rio Bonito do Iguaçu intra minuta die Veneris devastavit. Saltem sex homines mortui sunt et centeni vulnerati sunt.,2025-10-21 19:24:47+00:00
0737856da4be61db855d8f33e26dae4e,2025-11-09T09:01:59Z,'Taifun',www.zeit.de,de,0.9,"Taifun ""Fung-Wong"": Hunderttausende Philippiner verlassen wegen ""Fung-Wong"" ihre Häuser","""Fung-Wong"" soll mit starkem Regen und hohen Windgeschwindigkeiten die Philippinen erreichen. Nach ""Kalmaegi"" wappnen sich die Philippiner vor dem nächsten Taifun.",https://www.zeit.de/gesellschaft/zeitgeschehen/2025-11/taifun-fung-wong-philippinen-evakuierung,https://img.zeit.de/administratives/sharing/fallback-image-die-zeit/wide__1300x731,,"Auf den Philippinen haben rund eine Million Einwohner ihre Häuser verlassen müssen. Sie fliehen vor dem Supertaifun ""Fung-Wong"". Landesweit seien 916.863 Menschen in Sicherheit gebracht worden, erklä… [+473 chars]",,"Taifun ""Fung-Wong"": Hunderttausende Philippiner verlassen wegen ""Fung-Wong"" ihre Häuser. ""Fung-Wong"" soll mit starkem Regen und hohen Windgeschwindigkeiten die Philippinen erreichen. Nach ""Kalmaegi"" wappnen sich die Philippiner vor dem nächsten Taifun.","Typhoon ""Fung-Wong"": Hundreds of thousands of Filipinos leave their homes because of ""Fung-Wong"". “Fung-Wong” is expected to reach the Philippines with heavy rain and high wind speeds. After ""Kalmaegi"", the Filipinos are preparing for the next typhoon.","Typhoon ""Fung-Wong"": Centum milium Filipinos domos suas relinquunt propter ""Fung-Wong"". ""Fung-Wong"" expectatur ad Philippenses cum pluvia magna et celeritate ventorum magno. Post ""Kalmaegi"", Filipinos proximum typhonium parant.",2025-10-21 19:24:47+00:00
edcd8cb1c5eef826fabe4fcae18064dd,2025-11-09T09:45:53Z,'Taifun',www.sueddeutsche.de,de,0.9,Philippinen: Fast eine Million Menschen fliehen vor Taifun „Fung-Wong“,"Nach Regierungsangaben könnten insgesamt 8,4 Millionen Menschen vom Wirbelsturm betroffen sein, darunter 5,7 Millionen in Küstengemeinden.",https://www.sueddeutsche.de/panorama/philippinen-fung-wong-taifun-li.3336273,https://www.sueddeutsche.de/2025/11/09/d0d41cec-d061-4937-9f46-a1cd25f4ae4f.jpg?q=60&fm=webp&width=1200&rect=0%2C84%2C1600%2C900,,"Der Inselstaat ist gewarnt: Erst vor wenigen Tagen riss der verheerende TaifunKalmaegi dort Hunderte Menschen in den Tod und hinterließ eine Schneise der Zerstörung. Da Fung-Wong noch mehr Wucht hat,… [+1158 chars]",,"Philippinen: Fast eine Million Menschen fliehen vor Taifun „Fung-Wong“. Nach Regierungsangaben könnten insgesamt 8,4 Millionen Menschen vom Wirbelsturm betroffen sein, darunter 5,7 Millionen in Küstengemeinden.","Philippines: Almost a million people flee typhoon “Fung-Wong”. According to government figures, a total of 8.4 million people could be affected by the cyclone, including 5.7 million in coastal communities.","Philippinae: Fere decies centena millia hominum typhon ""Fung-Wong"" fugiunt. Secundum figuras regiminis, summa 8.4 miliones hominum ab cyclone, incluso 5.7 miliones in communitatibus maritimis, affici poterant.",2025-10-21 19:24:47+00:00
63abf857f6ed1963941f1b0151ea433b,2025-11-09T13:40:00Z,'Wirbelsturm',taz.de,de,0.9,"Philippinen erwarten „Fung-wong“: Fast 1,2 Millionen Menschen vor Supertaifun evakuiert","Kaum hat Taifun „Kalmaegi“, der 224 Tode forderte, den pazifischen Inselstaat verlassen, nähert sich ein womöglich noch stärkerer Wirbelsturm.",https://taz.de/Philippinen-erwarten-Fung-wong/!6128235/,https://taz.de/picture/8049111/1200/39662140.jpeg,,"Kaum hat Taifun „Kalmaegi“, der 224 Tode forderte, den pazifischen Inselstaat verlassen, nähert sich ein womöglich noch stärkerer Wirbelsturm. mehr...",,"Philippinen erwarten „Fung-wong“: Fast 1,2 Millionen Menschen vor Supertaifun evakuiert. Kaum hat Taifun „Kalmaegi“, der 224 Tode forderte, den pazifischen Inselstaat verlassen, nähert sich ein womöglich noch stärkerer Wirbelsturm.","Philippines expects “Fung-wong”: Nearly 1.2 million people evacuated ahead of super typhoon. Typhoon “Kalmaegi”, which caused 224 deaths, has barely left the Pacific island nation when a possibly even stronger cyclone is approaching.","Philippinae expectat ""Fung-wong"": Fere 1.2 decies centena millia hominum ante eximii typhonium decessisse. Typhoon ""Kalmaegi"", quae 224 mortes effecit, vix gentem insulae Pacificae reliquit cum forte etiam cyclone fortior appropinquare potest.",2025-10-21 19:24:47+00:00
264c7b6f63f5e264359effe275a62358,2025-11-09T14:27:21Z,'Wirbelsturm Tote',www.tagesspiegel.de,de,0.9,"Massenevakuierung, Überflutungen, Erdrutsche: Mindestens zwei Tote durch Supertaifun „Fung-Wong“ auf den Philippinen",Mit voller Wucht verwüstet der tropische Wirbelsturm zahlreiche Landstriche auf den Philippinen. Dank präventiver Evakuierungen bleibt Schlimmeres aus. Dennoch sind zwei Todesopfer zu beklagen.,https://www.tagesspiegel.de/gesellschaft/panorama/massenevakuierung-uberflutungen-erdrutsche-mindestens-zwei-tote-durch-supertaifun-fung-wong-auf-den-philippinen-14792741.html,https://www.tagesspiegel.de/images/14796935/alternates/BASE_16_9_W1400/1762756082000/strong-waves-caused-by-super-typhoon-typhoon-fung-wong-crash-near-a-residential-area-in-sicmil-gigmoto.jpeg,,"Der heftige Taifun Fung-Wong hat auf den nördlichen Philippinen mit Starkregen und Sturmböen gewütet. Mindestens zwei Menschen starben, mehr als 1,4 Millionen mussten ihre Häuser verlassen, wie die n… [+3554 chars]",,"Massenevakuierung, Überflutungen, Erdrutsche: Mindestens zwei Tote durch Supertaifun „Fung-Wong“ auf den Philippinen. Mit voller Wucht verwüstet der tropische Wirbelsturm zahlreiche Landstriche auf den Philippinen. Dank präventiver Evakuierungen bleibt Schlimmeres aus. Dennoch sind zwei Todesopfer zu beklagen.","Mass evacuation, floods, landslides: At least two dead from super typhoon “Fung-Wong” in the Philippines. The tropical cyclone devastated numerous areas in the Philippines with full force. Thanks to preventive evacuations, anything worse will happen. Nevertheless, there are two fatalities.","Missae evacuatio, inundationes, proruit: Saltem duo mortui e super typhonibus ""Fung-Wong"" in Philippinis. Cyclone tropicus numerosas areas in Philippinis vi plena devastavit. Propter purgationes praecavendas, quid deterius fiet. Duae tamen caedes sunt.",2025-10-21 19:24:47+00:00
4ddb9f0acb08c0f939dc3b64a915c841,2025-11-09T15:28:28Z,'Taifun',www.stern.de,de,0.9,"Taifun ""Fung-wong"" trifft auf Philippinen - Mehr als eine Million Menschen evakuiert","Auf den Philippinen sind wegen des Taifuns ""Fung-wong"" mehr als eine Million Menschen in Sicherheit gebracht worden. Der Sturm traf am Sonntagabend um 21.10 Uhr (Ortszeit, 14.10 Uhr MEZ) in der Provinz Aurora auf der Hauptinsel Luzon auf Land, wie der staatli…",https://www.stern.de/news/taifun--fung-wong--trifft-auf-philippinen---mehr-als-eine-million-menschen-evakuiert-36264048.html,https://image.stern.de/36276094/t/oj/v1/w1440/r1.7778/-/09--wassermassen-in-pandan-in-der-provinz-catanduanes---d5365702155d073c.jpg,,"Kopiere den aktuellen Link
Zur Merkliste hinzufügen
Auf den Philippinen sind wegen des Taifuns ""Fung-wong"" mehr als eine Million Menschen in Sicherheit gebracht worden. Der Sturm traf am Sonntagabe… [+3033 chars]",,"Taifun ""Fung-wong"" trifft auf Philippinen - Mehr als eine Million Menschen evakuiert. Auf den Philippinen sind wegen des Taifuns ""Fung-wong"" mehr als eine Million Menschen in Sicherheit gebracht worden. Der Sturm traf am Sonntagabend um 21.10 Uhr (Ortszeit, 14.10 Uhr MEZ) in der Provinz Aurora auf der Hauptinsel Luzon auf Land, wie der staatli…","Typhoon ""Fung-wong"" hits the Philippines - More than a million people evacuated. More than a million people have been brought to safety in the Philippines due to Typhoon ""Fung-wong."" The storm made landfall in Aurora province on the main island of Luzon at 9:10 p.m. (local time, 2:10 p.m. CET) on Sunday evening, according to the state...","Typhoon ""Fung-wong"" ferit Philippinas - Plus quam decies centena millia hominum excesserunt. Plus quam decies centena millia hominum in Philippinis ad salutem perducuntur ob Typhoon ""Fung-wong"". Tempestas terrae in Aurora provincia fecit in insula Luzon at 9:10 a.m. (locus temporis, 2:10 a.m. CET) vesperi dominicae, secundum statum.",2025-10-21 19:24:47+00:00
987a5b7a29bf22fb03445d165c478654,2025-11-10T06:06:36Z,'Wirbelsturm',www.stern.de,de,0.9,"Tropischer Wirbelsturm: Taifun ""Fung-Wong"" legt Teile der Philippinen lahm","Nach dem verheerenden Taifun ""Kalmaegi"" trifft ein neuer Sturm die Philippinen. Wieder gibt es Überflutungen und Schäden - aber dank präventiver Evakuierungen bleibt noch Schlimmeres aus.",https://www.stern.de/panorama/tropischer-wirbelsturm--taifun--fung-wong--legt-teile-der-philippinen-lahm-36295648.html,https://image.stern.de/36295650/t/wp/v1/w1440/r1.7778/-/10--a6c2ee2fb2v10axs2048jpeg---4dd97c5ad1652851.jpg,,"Kopiere den aktuellen Link
Zur Merkliste hinzufügen
Nach dem verheerenden Taifun ""Kalmaegi"" trifft ein neuer Sturm die Philippinen. Wieder gibt es Überflutungen und Schäden - aber dank präventiver … [+2148 chars]",,"Tropischer Wirbelsturm: Taifun ""Fung-Wong"" legt Teile der Philippinen lahm. Nach dem verheerenden Taifun ""Kalmaegi"" trifft ein neuer Sturm die Philippinen. Wieder gibt es Überflutungen und Schäden - aber dank präventiver Evakuierungen bleibt noch Schlimmeres aus.","Tropical cyclone: ​​Typhoon ""Fung-Wong"" paralyzes parts of the Philippines. After the devastating typhoon ""Kalmaegi"", a new storm hits the Philippines. There is flooding and damage again - but thanks to preventive evacuations, there is still nothing worse to come.","Cyclonus tropicus: Typhoon ""Fung-Wong"" paralyses partium Philippinarum. Post typhonum ""Kalmaegi"" devastatum, nova tempestas Philippenses pervenit. Inundatio et damnum iterum est - sed praecaventiae evacuationes, nihil est adhuc deterius venire.",2025-10-21 19:24:47+00:00
76e1d783e6a851ccdc4c1cf89438bf75,2025-11-10T06:06:36Z,'Wirbelsturm',www.zeit.de,de,0.9,"Tropischer Wirbelsturm: Taifun ""Fung-Wong"" legt Teile der Philippinen lahm","Hier finden Sie Informationen zu dem Thema „Tropischer Wirbelsturm“. Lesen Sie jetzt „Taifun ""Fung-Wong"" legt Teile der Philippinen lahm“.",https://www.zeit.de/news/2025-11/10/taifun-fung-wong-legt-teile-der-philippinen-lahm,https://img.zeit.de/news/2025-11/10/taifun-fung-wong-legt-teile-der-philippinen-lahm-image-group/wide__1300x731,,"Der heftige Taifun «Fung-Wong» hat auf den nördlichen Philippinen mit Starkregen und Sturmböen gewütet. Dennoch kam der Inselstaat dank Vorsichtsmaßnahmen glimpflicher davon als zunächst befürchtet.… [+2044 chars]",,"Tropischer Wirbelsturm: Taifun ""Fung-Wong"" legt Teile der Philippinen lahm. Hier finden Sie Informationen zu dem Thema „Tropischer Wirbelsturm“. Lesen Sie jetzt „Taifun ""Fung-Wong"" legt Teile der Philippinen lahm“.","Tropical cyclone: ​​Typhoon ""Fung-Wong"" paralyzes parts of the Philippines. Here you will find information on the topic of “Tropical Cyclones”. Now read “Typhoon “Fung-Wong” paralyzes parts of the Philippines”.","Cyclonus tropicus: Typhoon ""Fung-Wong"" paralyses partium Philippinarum. Hic informationes invenies in argumento ""Tropicalis Cyclonis"". Nunc lege ""Typhoon ""Fung-Wong"" partes Philippinarum torpescit.",2025-10-21 19:24:47+00:00
d7cf556becb3a9107905c8bda0c1149f,2025-11-10T06:08:02Z,'Wirbelsturm Schäden',www.tagesspiegel.de,de,0.9,Tropischer Wirbelsturm: Taifun „Fung-Wong“ legt Teile der Philippinen lahm,Nach dem verheerenden Taifun „Kalmaegi“ trifft ein neuer Sturm die Philippinen. Wieder gibt es Überflutungen und Schäden - aber dank präventiver Evakuierungen bleibt noch Schlimmeres aus.,https://www.tagesspiegel.de/gesellschaft/panorama/tropischer-wirbelsturm-taifun-fung-wong-legt-teile-der-philippinen-lahm-14796896.html,https://www.tagesspiegel.de/images/14796893/alternates/BASE_16_9_W1400/1762754882000/taifun-fung-wong-philippinen.jpeg,,"Der heftige Taifun Fung-Wong hat auf den nördlichen Philippinen mit Starkregen und Sturmböen gewütet. Dennoch kam der Inselstaat dank Vorsichtsmaßnahmen glimpflicher davon als zunächst befürchtet.
E… [+2660 chars]",,Tropischer Wirbelsturm: Taifun „Fung-Wong“ legt Teile der Philippinen lahm. Nach dem verheerenden Taifun „Kalmaegi“ trifft ein neuer Sturm die Philippinen. Wieder gibt es Überflutungen und Schäden - aber dank präventiver Evakuierungen bleibt noch Schlimmeres aus.,"Tropical cyclone: ​​Typhoon “Fung-Wong” paralyzes parts of the Philippines. After the devastating typhoon “Kalmaegi”, a new storm hits the Philippines. There is flooding and damage again - but thanks to preventive evacuations, there is still nothing worse to come.","Cyclonus tropicus: Typhoon ""Fung-Wong"" partium Philippinarum torpescit. Post typhonum ""Kalmaegi"" devastatum, nova tempestas Philippenses pervenit. Inundatio et damnum iterum est - sed praecaventiae evacuationes, nihil est adhuc deterius venire.",2025-10-21 19:24:47+00:00
