index,published,keyword,domain,language,valid,title,description,url,image,archive,content,quote,de,en,la,added
c565746fa6a6a50ee92f62a19f6c3253,2025-11-02T02:26:02Z,'Hurrikan',www.tagesspiegel.de,de,1.0,Tödlicher Sturm „Melissa“: Opferzahl nach Hurrikan-Katastrophe in Karibik steigt weiter,"Wirbelsturm „Melissa“ hat auf Jamaika verheerende Schäden angerichtet. Viele sind in Not: Hilfsgüter erreichen abgeschnittene Orte kaum, Nahrungsmittel werden knapp, Tausende Touristen sitzen fest.",https://www.tagesspiegel.de/gesellschaft/panorama/todlicher-sturm-melissa-opferzahl-nach-hurrikan-katastrophe-in-karibik-steigt-weiter-14723807.html,https://www.tagesspiegel.de/images/14723804/alternates/BASE_16_9_W1400/1762050362000/hurrikan-melissa-jamaika.jpeg,,Der verheerende Hurrikan Melissa hat in der Karibik noch mehr Menschen in den Tod gerissen als bisher bekannt. Allein in Jamaika gibt es nach Regierungsangaben inzwischen 28 bestätigte Todesfälle. Zu… [+2640 chars],,"Tödlicher Sturm „Melissa“: Opferzahl nach Hurrikan-Katastrophe in Karibik steigt weiter. Wirbelsturm „Melissa“ hat auf Jamaika verheerende Schäden angerichtet. Viele sind in Not: Hilfsgüter erreichen abgeschnittene Orte kaum, Nahrungsmittel werden knapp, Tausende Touristen sitzen fest.","Deadly storm “Melissa”: The number of victims after hurricane disaster in the Caribbean continues to rise. Hurricane Melissa caused devastating damage in Jamaica. Many are in need: aid supplies barely reach cut-off places, food is becoming scarce, and thousands of tourists are stranded.","Tempestas mortifera ""Melissa"": numerus victimarum post calamitatem procellae in Caribbean oriri pergit. Procellae Melissa damnum in Jamaica vastare fecit. Multi egentes sunt: ​​commeatus commeatus vix abscissos locos attingunt, cibus vix fit, et mille peregrinatores destituti sunt.",2025-10-21 19:24:47+00:00
7a398bd1ed151b3c5f5cb4b312e4cc70,2025-11-02T03:03:26Z,'Wirbelsturm Schäden',www.faz.net,de,1.0,Jahrhundertsturm „Melissa“: Opferzahl nach Hurrikan-Katastrophe in Karibik steigt weiter,"Wirbelsturm „Melissa“ hat auf Jamaika verheerende Schäden angerichtet. Viele sind in Not: Hilfsgüter erreichen abgeschnittene Orte kaum, Nahrungsmittel werden knapp, Tausende Touristen sitzen fest.",https://www.faz.net/aktuell/gesellschaft/ungluecke/jahrhundertsturm-melissa-opferzahl-nach-hurrikan-katastrophe-in-karibik-steigt-weiter-accg-110760908.html,https://media0.faz.net/ppmedia/w1200/aktuell/politik/3935027633/1.10760910/facebook_teaser/hurrikan-melissa-hat-auf.jpg.webp,,Der verheerende Hurrikan Melissa hat in der Karibik noch mehr Menschen in den Tod gerissen als bisher bekannt. Allein in Jamaika gibt es nach Regierungsangaben inzwischen 28 bestätigte Todesfälle. Zu… [+2537 chars],,"Jahrhundertsturm „Melissa“: Opferzahl nach Hurrikan-Katastrophe in Karibik steigt weiter. Wirbelsturm „Melissa“ hat auf Jamaika verheerende Schäden angerichtet. Viele sind in Not: Hilfsgüter erreichen abgeschnittene Orte kaum, Nahrungsmittel werden knapp, Tausende Touristen sitzen fest.","Storm of the century “Melissa”: The number of victims after the hurricane catastrophe in the Caribbean continues to rise. Hurricane Melissa caused devastating damage in Jamaica. Many are in need: aid supplies barely reach cut-off places, food is becoming scarce, and thousands of tourists are stranded.","Tempestas saeculi ""Melissa"": numerus victimarum post procellam calamitatis in Caribbean oriri pergit. Procellae Melissa damnum in Jamaica vastare fecit. Multi egentes sunt: ​​commeatus commeatus vix abscissos locos attingunt, cibus vix fit, et mille peregrinatores destituti sunt.",2025-10-21 19:24:47+00:00
0d5878129e336a6dc09a01eeb5a94196,2025-11-02T07:03:03Z,'Wirbelsturm Schäden',www.tagesschau.de,de,1.0,"Jamaika: Zahl der Toten nach Hurrikan ""Melissa"" gestiegen","Im Karibikstaat Jamaika ist die Zahl der Toten nach Hurrikan ""Melissa"" gestiegen. Einige Gebiete sind noch immer von der Außenwelt abgeschnitten. Auch Touristen sitzen weiter fest: Viele für gestern geplante Flüge fielen aus.",https://www.tagesschau.de/ausland/amerika/opferzahlen-hurrikan-melissa-100.html,https://images.tagesschau.de/image/64c18389-b75c-4db2-b830-9d9be34bfd2d/AAABmkNgZl0/AAABmgWmh8Q/16x9-big/melissa-hurrikan-jamaika-100.jpg?width=1280,,"Stand: 02.11.2025 08:03 Uhr
Im Karibikstaat Jamaika ist die Zahl der Toten nach Hurrikan ""Melissa"" gestiegen. Einige Gebiete sind noch immer von der Außenwelt abgeschnitten. Auch Touristen sitzen we… [+4803 chars]",,"Jamaika: Zahl der Toten nach Hurrikan ""Melissa"" gestiegen. Im Karibikstaat Jamaika ist die Zahl der Toten nach Hurrikan ""Melissa"" gestiegen. Einige Gebiete sind noch immer von der Außenwelt abgeschnitten. Auch Touristen sitzen weiter fest: Viele für gestern geplante Flüge fielen aus.",Jamaica: Number of deaths increased after Hurricane Melissa. The number of deaths after Hurricane Melissa has risen in the Caribbean state of Jamaica. Some areas are still cut off from the outside world. Tourists are also still stuck: many flights planned for yesterday were canceled.,Jamaica: Numerus funerum post Melissae Procellae auctus. Numerus funerum post Hurricane Melissa in statu Caribbeana Iamaicae orta est. Quibusdam locis ab exterioribus adhuc abscissis. Peregrinatores etiam adhuc haeserunt: plures volatus pro hesterno proposito surlati sunt.,2025-10-21 19:24:47+00:00
24714b75c17a0dbc9c7fdd5c7ed4017b,2025-11-02T07:03:29Z,'Hurrikan',orf.at,de,1.0,Karibik: Opferzahl nach Hurrikan „Melissa“ gestiegen,,https://orf.at/stories/3410280/,https://orf.at/mojo/1_4_1/storyserver//news/common/images/og-fallback-news.png,,Der verheerende Hurrikan Melissa hat in der Karibik noch mehr Menschen in den Tod gerissen als bisher bekannt. Allein in Jamaika gibt es nach Regierungsangaben inzwischen 28 bestätigte Todesfälle. Zu… [+1916 chars],,Karibik: Opferzahl nach Hurrikan „Melissa“ gestiegen. nan,Caribbean: Number of victims increased after Hurricane Melissa. nan,Caribbean: Numerus victimarum post Melissa Procellae auctus est. nan,2025-10-21 19:24:47+00:00
c6ef1d2f2ecc3caa4eca5045fd0253c5,2025-11-03T04:18:36Z,'Hurrikan',www.tagesschau.de,de,1.0,"Dreitägige Staatstrauer in Haiti nach Hurrikan ""Melissa""","Haitis Regierung hat angesichts der verheerenden Auswirkungen des Hurrikans ""Melissa"" eine dreitägige Staatstrauer ausgerufen. Sie gilt ab heute. Die USA sagten Kuba eine Nothilfe von drei Millionen Dollar zu.",https://www.tagesschau.de/ausland/amerika/melissa-haiti-100.html,https://images.tagesschau.de/image/64c18389-b75c-4db2-b830-9d9be34bfd2d/AAABmkNgZl0/AAABmgWmh8Q/16x9-big/melissa-hurrikan-jamaika-100.jpg?width=1280,,"Stand: 03.11.2025 05:18 Uhr
Haitis Regierung hat angesichts der verheerenden Auswirkungen des Hurrikans ""Melissa"" eine dreitägige Staatstrauer ausgerufen. Sie gilt ab heute. Die USA sagten Kuba eine… [+1533 chars]",,"Dreitägige Staatstrauer in Haiti nach Hurrikan ""Melissa"". Haitis Regierung hat angesichts der verheerenden Auswirkungen des Hurrikans ""Melissa"" eine dreitägige Staatstrauer ausgerufen. Sie gilt ab heute. Die USA sagten Kuba eine Nothilfe von drei Millionen Dollar zu.",Three days of national mourning in Haiti after Hurricane Melissa. Haiti's government has declared three days of national mourning due to the devastating effects of Hurricane Melissa. It applies from today. The USA promised Cuba emergency aid of three million dollars.,Tres dies luctus nationalis in Haitia post Procellae Melissae. Regimen Haiti declaravit tres dies luctus nationalis ob vastationes effectus Hurricane Melissae. Appellatur ab hodierno die. USA tres miliones dollariorum auxilium subitis Cubae pollicitus est.,2025-10-21 19:24:47+00:00
baf31f117e1f223b41ddd7cf4c54ea24,2025-11-03T05:43:39Z,'Tropensturm',www.tagesspiegel.de,de,1.0,Heftige Niederschläge: 37 Tote bei Überschwemmungen in Vietnam,Häuser und Straßen stehen in Teilen Vietnams seit einer Woche unter Wasser. Jetzt nähert sich auch noch ein Tropensturm dem südostasiatischen Land.,https://www.tagesspiegel.de/gesellschaft/panorama/heftige-niederschlage-37-tote-bei-uberschwemmungen-in-vietnam-14728343.html,https://www.tagesspiegel.de/images/14728340/alternates/BASE_16_9_W1400/1762148618000/uberschwemmungen-in-vietnam.jpeg,,"Starke Regenfälle sorgen seit einer Woche für schwere Überschwemmungen in Teilen Vietnams. Die Zahl der Toten ist inzwischen auf 37 gestiegen, wie örtliche Behörden am Montag mitteilten. Fünf Mensche… [+1139 chars]",,Heftige Niederschläge: 37 Tote bei Überschwemmungen in Vietnam. Häuser und Straßen stehen in Teilen Vietnams seit einer Woche unter Wasser. Jetzt nähert sich auch noch ein Tropensturm dem südostasiatischen Land.,Heavy rainfall: 37 dead in floods in Vietnam. Houses and streets have been under water in parts of Vietnam for a week. Now a tropical storm is approaching the Southeast Asian country.,Imbribus gravis: 37 mortuus in inundationibus in Vietnam. Domus et plateae sub aquis in partibus Vietnamia per hebdomadam fuerunt. Nunc tropica tempestas ad regionem Southeast Asiam appropinquat.,2025-10-21 19:24:47+00:00
bfaaf5ef79df565be594348e6f2775a1,2025-11-03T05:46:10Z,'Hurrikan',www.faz.net,de,1.0,Nach Hurrikan „Melissa“: Staatstrauer in Haiti – USA wollen Kuba finanziell unterstützen,"Nach Hurrikan „Melissa“ trauert Haiti um mindestens 30 Tote. Jamaika will internationale Reggae-Konzerte organisieren, um beim Wiederaufbau zu helfen. Und die USA sagen Kuba drei Millionen Dollar Nothilfe zu.",https://www.faz.net/aktuell/gesellschaft/ungluecke/hurrikan-melissa-dreitaegige-staatstrauer-in-haiti-und-usa-wollen-kuba-finanziell-unterstuetzen-accg-110762131.html,https://media1.faz.net/ppmedia/w1200/aktuell/gesellschaft/2320780517/1.10758225/facebook_teaser/jamaika-black-river-menschen.jpg.webp,,Aufgrund der dramatischen Folgen von Hurrikan Melissa hat Haitis Regierung drei Tage Staatstrauer ab dem heutigen Montag angeordnet. Infolge des Wirbelsturms kamen in dem Karibikstaat bei Überschwemm… [+1714 chars],,"Nach Hurrikan „Melissa“: Staatstrauer in Haiti – USA wollen Kuba finanziell unterstützen. Nach Hurrikan „Melissa“ trauert Haiti um mindestens 30 Tote. Jamaika will internationale Reggae-Konzerte organisieren, um beim Wiederaufbau zu helfen. Und die USA sagen Kuba drei Millionen Dollar Nothilfe zu.","After Hurricane “Melissa”: national mourning in Haiti – USA wants to support Cuba financially. After Hurricane Melissa, Haiti mourns at least 30 deaths. Jamaica wants to organize international reggae concerts to help with reconstruction. And the USA is promising Cuba three million dollars in emergency aid.","Post Procellae ""Melissa"": luctus nationalis in Haiti - USA vult financially Cubam sustinere. Post Procellae Melissa, Haitia saltem 30 mortes luget. Jamaica vult concentus reggae internationales instituere ut auxilium cum reconstructione praebeant. USA autem tres miliones dollariorum subitis auxiliis pollicitus est.",2025-10-21 19:24:47+00:00
feef71cfcdd21b90cc9486ac591bdb72,2025-11-03T08:49:49Z,'Taifun',www.stern.de,de,1.0,"Taifun ""Kalmaegi"": Tausende Menschen auf den Philippinen in Sicherheit gebracht","Auf den Philippinen sind tausende Menschen vor einem herannahenden Taifun in Sicherheit gebracht worden. Wie der Wetterdienst des Inselstaats mitteilte, steuerte Taifun ""Kalmaegi"" am Montag mit Windgeschwindigkeiten von 120 Stundenkilometern und Böen von bis …",https://www.stern.de/news/taifun--kalmaegi---tausende-menschen-auf-den-philippinen-in-sicherheit-gebracht-36183388.html,https://image.stern.de/36183390/t/RU/v1/w1440/r1.7778/-/03--fluechtende-in-der-stadt-san-julian---63a6b6e53f45d36e.jpg,,"Kopiere den aktuellen Link
Zur Merkliste hinzufügen
Auf den Philippinen sind tausende Menschen vor einem herannahenden Taifun in Sicherheit gebracht worden. Wie der Wetterdienst des Inselstaats mit… [+1348 chars]",,"Taifun ""Kalmaegi"": Tausende Menschen auf den Philippinen in Sicherheit gebracht. Auf den Philippinen sind tausende Menschen vor einem herannahenden Taifun in Sicherheit gebracht worden. Wie der Wetterdienst des Inselstaats mitteilte, steuerte Taifun ""Kalmaegi"" am Montag mit Windgeschwindigkeiten von 120 Stundenkilometern und Böen von bis …","Typhoon ""Kalmaegi"": Thousands of people brought to safety in the Philippines. Thousands of people have been brought to safety from an approaching typhoon in the Philippines. As the island state's weather service announced, typhoon ""Kalmaegi"" hit on Monday with wind speeds of 120 kilometers per hour and gusts of up to ...","Typhoon ""Kalmaegi"": Milia hominum in Philippinis ad salutem perducta sunt. Milia hominum ab accessu typhonis in Philippinis ad salutem perducta sunt. Cum insulae status tempestatum ministerium denuntiavit, typhon ""Kalmaegi"" die Lunae cum velocitatibus ventorum 120 chiliometrorum per horae et procellis usque ad ... feritur.",2025-10-21 19:24:47+00:00
ee327bbeec5b5191ab477d759129a4ed,2025-11-04T00:34:23Z,'Hurrikan',www.zeit.de,de,1.0,Hurrikan Melissa: Zahl der Toten in Jamaika steigt auf 32,"Der Karibikstaat Jamaika versucht, nach Hurrikan Melissa die Aufräumarbeiten voranzubringen. Fast die Hälfte aller Haushalte auf der Insel ist weiter ohne Strom.",https://www.zeit.de/gesellschaft/zeitgeschehen/2025-11/hurrikan-melissa-zahl-der-toten-jamaika-steigt,https://img.zeit.de/gesellschaft/zeitgeschehen/2025-11/hurrikan-melissa-zahl-der-toten-jamaika-steigt-bild/wide__1300x731,,"Nach dem verheerenden Hurrikan Melissa ist die 
Zahl der Toten auf Jamaika auf 32 gestiegen. Das teilte die 
Regierung am Montag (Ortszeit) mit und sagte, dass die Zahl der Toten vermutlich weiter … [+726 chars]",,"Hurrikan Melissa: Zahl der Toten in Jamaika steigt auf 32. Der Karibikstaat Jamaika versucht, nach Hurrikan Melissa die Aufräumarbeiten voranzubringen. Fast die Hälfte aller Haushalte auf der Insel ist weiter ohne Strom.",Hurricane Melissa: Number of deaths in Jamaica rises to 32. The Caribbean country of Jamaica is trying to advance the clean-up work after Hurricane Melissa. Almost half of all households on the island are still without electricity.,Procellae Melissa: Numerus funerum in Iamaica oritur 32. In Caribbeana regione Iamaicae opus mundanum post Melissam progredi conatur. Fere dimidium omnium familiarum in insula adhuc sine electricitate sunt.,2025-10-21 19:24:47+00:00
313c36f99044947b52a8bd6ff200e190,2025-11-04T05:34:00Z,'Taifun',www.zeit.de,de,1.0,"Tropensturm in Südostasien: Taifun ""Kalmaegi"" trifft Philippinen – mindestens drei Tote","Hier finden Sie Informationen zu dem Thema „Tropensturm in Südostasien“. Lesen Sie jetzt „Taifun ""Kalmaegi"" trifft Philippinen – mindestens drei Tote“.",https://www.zeit.de/news/2025-11/04/taifun-kalmaegi-trifft-philippinen-mindestens-drei-tote,https://img.zeit.de/news/2025-11/04/taifun-kalmaegi-trifft-philippinen-mindestens-drei-tote-image-group/wide__1300x731,,"Auf den Philippinen hat der Taifun «Kalmaegi» mindestens drei Menschen das Leben gekostet. Der Wirbelsturm brachte orkanartige Böen, heftige Regenfälle und meterhohe Flutwellen über Teile des Inselst… [+2352 chars]",,"Tropensturm in Südostasien: Taifun ""Kalmaegi"" trifft Philippinen – mindestens drei Tote. Hier finden Sie Informationen zu dem Thema „Tropensturm in Südostasien“. Lesen Sie jetzt „Taifun ""Kalmaegi"" trifft Philippinen – mindestens drei Tote“.","Tropical storm in Southeast Asia: Typhoon ""Kalmaegi"" hits the Philippines - at least three dead. Here you will find information on the topic “Tropical Storm in Southeast Asia”. Now read “Typhoon “Kalmaegi” hits the Philippines – at least three dead”.","Tropical tempestas in Asia Australi: Typhoon ""Kalmaegi"" Philippinas - saltem tres mortuos pervenit. Hic reperies informationem de argumento ""Tropical Storm in Southeast Asia"". Nunc legitur ""Typhon ""Kalmaegi"" Philippenses saltem tres mortuos ferit.",2025-10-21 19:24:47+00:00
2017dc68831291febe830fcadd025d4a,2025-11-04T05:35:23Z,'Taifun',www.tagesspiegel.de,de,1.0,Tropensturm in Südostasien: Taifun „Kalmaegi“ trifft Philippinen: mindestens sieben Tote,"Heftige Böen, meterhohe Flutwellen, zerstörte Häuser: Der Taifun „Kalmaegi“ setzt den Philippinen zu. Auch in Vietnam und Thailand herrscht große Sorge.",https://www.tagesspiegel.de/gesellschaft/panorama/tropensturm-in-sudostasien-taifun-kalmaegi-trifft-philippinen-mindestens-sieben-tote-14744282.html,https://www.tagesspiegel.de/images/14744507/alternates/BASE_16_9_W1400/1762241428000/taifun-kalmaegi-philippinen.jpeg,,"Auf den Philippinen hat der Taifun Kalmaegi mindestens sieben Menschen das Leben gekostet. Der Wirbelsturm brachte orkanartige Böen, heftige Regenfälle und meterhohe Flutwellen über Teile des Inselst… [+3226 chars]",,"Tropensturm in Südostasien: Taifun „Kalmaegi“ trifft Philippinen: mindestens sieben Tote. Heftige Böen, meterhohe Flutwellen, zerstörte Häuser: Der Taifun „Kalmaegi“ setzt den Philippinen zu. Auch in Vietnam und Thailand herrscht große Sorge.","Tropical storm in Southeast Asia: Typhoon “Kalmaegi” hits the Philippines: at least seven dead. Violent gusts, meter-high tidal waves, destroyed houses: Typhoon “Kalmaegi” is hitting the Philippines. There is also great concern in Vietnam and Thailand.","Tropical tempestas in Asia Australi: Typhoon ""Kalmaegi"" Philippenses ferit: saltem septem mortuos. Vehementes procellae, undae metri altae, domos deleverunt: Typhoon ""Kalmaegi"" ferit Philippinas. Magna etiam cura est in Vietnam et Thailandia.",2025-10-21 19:24:47+00:00
3384687e3d7d5f39ef27f846abfbc389,2025-11-04T09:27:57Z,'Taifun',www.stern.de,de,1.0,"Tropensturm in Südostasien: Taifun ""Kalmaegi"" trifft Philippinen: mindestens sieben Tote","Heftige Böen, meterhohe Flutwellen, zerstörte Häuser: Der Taifun ""Kalmaegi"" setzt den Philippinen zu. Auch in Vietnam und Thailand herrscht große Sorge.",https://www.stern.de/panorama/tropensturm-in-suedostasien--taifun--kalmaegi--trifft-philippinen--mindestens-sieben-tote-36186198.html,https://image.stern.de/36186330/t/WN/v2/w1440/r1.7778/-/04--xyhhhfvj7tv3axs2048jpeg---ba30673bf6451fc4.jpg,,"Kopiere den aktuellen Link
Zur Merkliste hinzufügen
Heftige Böen, meterhohe Flutwellen, zerstörte Häuser: Der Taifun ""Kalmaegi"" setzt den Philippinen zu. Auch in Vietnam und Thailand herrscht große… [+2685 chars]",,"Tropensturm in Südostasien: Taifun ""Kalmaegi"" trifft Philippinen: mindestens sieben Tote. Heftige Böen, meterhohe Flutwellen, zerstörte Häuser: Der Taifun ""Kalmaegi"" setzt den Philippinen zu. Auch in Vietnam und Thailand herrscht große Sorge.","Tropical storm in Southeast Asia: Typhoon ""Kalmaegi"" hits the Philippines: at least seven dead. Violent gusts, meter-high tidal waves, destroyed houses: Typhoon ""Kalmaegi"" is hitting the Philippines. There is also great concern in Vietnam and Thailand.","Tropical tempestas in Asia Meridiana: Typhoon ""Kalmaegi"" Philippinas pervenit: saltem septem mortuos. Vehementes procellae, fluctus metri altae, domos deleverunt: Typhoon ""Kalmaegi"" ferit Philippinas. Magna etiam cura est in Vietnam et Thailandia.",2025-10-21 19:24:47+00:00
9d0f724e35d413a259a60d82c1e872ea,2025-11-05T01:13:34Z,'Wirbelsturm',www.zeit.de,de,1.0,Hurrikan Melissa: Wirbelsturm dürfte Jamaika ein Drittel der Wirtschaftsleistung kosten,"Hurrikan Melissa, einer der schwersten je registrierten Stürme des Atlantiks, sei eine Warnung an die Welt, sagt Jamaikas Präsident. Die Schadensaufnahme hat begonnen.",https://www.zeit.de/gesellschaft/zeitgeschehen/2025-11/hurrikan-melissa-schaeden-jamaika,https://img.zeit.de/gesellschaft/zeitgeschehen/2025-11/hurrikan-melissa-schaeden-jamaica-bild/wide__1300x731,,"Jamaika hat nach den Verwüstungen durch einen der stärksten Hurrikane über dem Atlantik eine erste Schadensbilanz
gezogen. Demnach hat Wirbelsturm Melissa Infrastruktur und Häuser im Wert von
minde… [+3123 chars]",,"Hurrikan Melissa: Wirbelsturm dürfte Jamaika ein Drittel der Wirtschaftsleistung kosten. Hurrikan Melissa, einer der schwersten je registrierten Stürme des Atlantiks, sei eine Warnung an die Welt, sagt Jamaikas Präsident. Die Schadensaufnahme hat begonnen.","Hurricane Melissa: Hurricane is likely to cost Jamaica a third of its economic output. Hurricane Melissa, one of the most severe Atlantic storms ever recorded, is a warning to the world, says Jamaica's president. The damage assessment has begun.","Procellae Melissa: Turbo verisimile est iamaicam tertiam partem eius oeconomici output constare. Procellae Melissa, una ex gravissimis tempestatibus Atlanticis, quam commemoravit, monitum est mundo, dicit praeses Iamaica. Damnum taxatio incepit.",2025-10-21 19:24:47+00:00
6dbb3d87e1bcfa0f1243fca2740d2e94,2025-11-05T06:33:04Z,'Taifun',orf.at,de,1.0,Taifun „Kalmaegi“ traf auf Philippinen: Dutzende Tote,,https://orf.at/stories/3410561/,https://orf.at/mojo/1_4_1/storyserver//news/common/images/og-fallback-news.png,,"Auf den Philippinen ist die Zahl der Toten durch den schweren Taifun Kalmaegi heute gestiegen. Mindestens 66 Menschen kamen nach Angaben des Zivilschutzes ums Leben, 26 weitere werden noch vermisst. … [+1578 chars]",,Taifun „Kalmaegi“ traf auf Philippinen: Dutzende Tote. nan,Typhoon “Kalmaegi” hits the Philippines: dozens dead. nan,"Typhoon ""Kalmaegi"" ferit Philippinas: justos mortuos. nan",2025-10-21 19:24:47+00:00
5d2a6b8ba93cbec5b1b8406b89c5a2af,2025-11-05T13:16:08Z,'Wirbelsturm',www.stern.de,de,1.0,Tropensturm in Südostasien: Taifun hinterlässt Zerstörung auf den Philippinen - 91 Tote,"Autos türmen sich, Menschen fliehen auf ihre Dächer: Der Taifun ""Kalmaegi"" hat Hunderttausende Philippiner in die Flucht getrieben. Während die Opferzahl steigt, nähert sich schon der nächste Sturm.",https://www.stern.de/panorama/tropensturm-in-suedostasien--taifun-hinterlaesst-zerstoerung-auf-den-philippinen---91-tote-36189650.html,https://image.stern.de/36189652/t/KM/v2/w1440/r1.7778/-/05--a6wlkeisnbv12axs2048jpeg---6225e9d78312d607.jpg,,"Kopiere den aktuellen Link
Zur Merkliste hinzufügen
Autos türmen sich, Menschen fliehen auf ihre Dächer: Der Taifun ""Kalmaegi"" hat Hunderttausende Philippiner in die Flucht getrieben. Während die O… [+2225 chars]",,"Tropensturm in Südostasien: Taifun hinterlässt Zerstörung auf den Philippinen - 91 Tote. Autos türmen sich, Menschen fliehen auf ihre Dächer: Der Taifun ""Kalmaegi"" hat Hunderttausende Philippiner in die Flucht getrieben. Während die Opferzahl steigt, nähert sich schon der nächste Sturm.","Tropical storm in Southeast Asia: Typhoon leaves destruction in the Philippines - 91 dead. Cars are piling up, people are fleeing to their roofs: Typhoon ""Kalmaegi"" has forced hundreds of thousands of Filipinos to flee. While the number of victims rises, the next storm is already approaching.","Tempestas tropica in Asia Australi: Typhonis interitum relinquit in Philippinis - 91 mortuis. Cars struunt, homines ad tecta fugiunt: Typhoon ""Kalmaegi"" centena milia Filipinos fugere coegit. Dum numerus victimarum surgit, proxima tempestas iam appropinquat.",2025-10-21 19:24:47+00:00
c6c43c2a711d0ecf702b00a46609ded2,2025-11-06T02:51:16Z,'Tropensturm',www.stern.de,de,1.0,Tropensturm in Südostasien: Zahl der Toten nach Taifun auf den Philippinen steigt,"Autos auf Dächern, ganze Dörfer im Schlamm: Taifun ""Kalmaegi"" hinterlässt Chaos auf den Philippinen. Jetzt nähert sich der Sturm ""Fung-Wong"" - wird er zum Supertaifun?",https://www.stern.de/panorama/tropensturm-in-suedostasien--zahl-der-toten-nach-taifun-auf-den-philippinen-steigt-36193320.html,https://image.stern.de/36193322/t/oR/v1/w1440/r1.7778/-/06--qsqmcjjcy5v3axs2048jpeg---354beaed692e84ba.jpg,,"Kopiere den aktuellen Link
Zur Merkliste hinzufügen
Autos auf Dächern, ganze Dörfer im Schlamm: Taifun ""Kalmaegi"" hinterlässt Chaos auf den Philippinen. Jetzt nähert sich der Sturm ""Fung-Wong"" - wi… [+2126 chars]",,"Tropensturm in Südostasien: Zahl der Toten nach Taifun auf den Philippinen steigt. Autos auf Dächern, ganze Dörfer im Schlamm: Taifun ""Kalmaegi"" hinterlässt Chaos auf den Philippinen. Jetzt nähert sich der Sturm ""Fung-Wong"" - wird er zum Supertaifun?","Tropical storm in Southeast Asia: Number of deaths after typhoon in the Philippines increases. Cars on roofs, entire villages in the mud: Typhoon ""Kalmaegi"" leaves chaos in the Philippines. Now the storm ""Fung-Wong"" is approaching - will it become a super typhoon?","Tempestas tropica in Asia Australi est: Numerus funerum post typhonium in Philippinis crescit. Cars in tectis, pagi integri in limo: Typhoon ""Kalmaegi"" chaos in Philippinis relinquit. Nunc tempestas ""Fung-Wong"" appropinquat - fietne super typhon?",2025-10-21 19:24:47+00:00
