index,published,keyword,domain,language,valid,title,description,url,image,archive,content,quote,de,en,la,added
9cd5fe2c10085a47e9591e275ba7a3ea,2025-11-01T02:39:25Z,'Wirbelsturm',www.tagesspiegel.de,de,0.0,Nach Hurrikan „Melissa“: Kliniken auf Jamaika sind am Limit – Ärzte dringend gesucht,Nach dem verheerenden Wirbelsturm arbeiten Mediziner auf der Karibikinsel unter teils extremen Bedingungen. Auch Treibstoff ist knapp. Kuba kämpft weiter mit schweren Überschwemmungen.,https://www.tagesspiegel.de/gesellschaft/panorama/nach-hurrikan-melissa-kliniken-auf-jamaika-sind-am-limit--arzte-dringend-gesucht-14720723.html,https://www.tagesspiegel.de/images/14720903/alternates/BASE_16_9_W1400/1761980767000/hurrikan-melissa-jamaika.jpeg,,"Notstand in Jamaika: Weil der verheerende Hurrikan Melissa auch viele Krankenhäuser beschädigt hat, plant die Regierung des karibischen Inselstaats in fünf westlichen Bezirken die Errichtung von Feld… [+4247 chars]",,Nach Hurrikan „Melissa“: Kliniken auf Jamaika sind am Limit – Ärzte dringend gesucht. Nach dem verheerenden Wirbelsturm arbeiten Mediziner auf der Karibikinsel unter teils extremen Bedingungen. Auch Treibstoff ist knapp. Kuba kämpft weiter mit schweren Überschwemmungen.,"After Hurricane “Melissa”: Clinics in Jamaica are at their limit – doctors are urgently needed. After the devastating hurricane, doctors on the Caribbean island are working under sometimes extreme conditions. Fuel is also scarce. Cuba continues to struggle with severe flooding.","Post Procellae ""Melissa"": Clinics in Jamaica ad suum modum sunt - doctores instanter exiguntur. Post vastitatem turbinis medici in insula Caribbeana interdum extrema condicione laborant. Cibus quoque vix. Cuba gravi inundatione conflictari pergit.",2025-10-21 19:24:47+00:00
3203bf958922cff3ed11b2dea28b9f79,2025-11-02T04:29:26Z,'Hurrikan',www.zeit.de,de,0.0,Hurrikan Melissa: Jamaika kündigt Aufbau von Feldlazaretten an,Vor allem im Westen der Insel sind Krankenhäuser beschädigt. Mit internationaler Hilfe werden nun Feldlazarette errichtet. Die Gesamtzahl der Toten steigt auf fast 60.,https://www.zeit.de/gesellschaft/zeitgeschehen/2025-11/hurrikan-melissa-jamaika-feldlazarett-todesfaelle,https://img.zeit.de/gesellschaft/zeitgeschehen/2025-11/hurrikan-melissa-jamaika-feldlazarett-todesfaelle-bild/wide__1300x731,,Nach den Verwüstungen durch den Hurrikan Melissa hat die jamaikanische Regierung den Aufbau mehrerer Feldlazarette angekündigt. Das erste derartige Notkrankenhaus soll am heutigen Sonntag in der Stad… [+1267 chars],,Hurrikan Melissa: Jamaika kündigt Aufbau von Feldlazaretten an. Vor allem im Westen der Insel sind Krankenhäuser beschädigt. Mit internationaler Hilfe werden nun Feldlazarette errichtet. Die Gesamtzahl der Toten steigt auf fast 60.,"Hurricane Melissa: Jamaica announces construction of field hospitals. Hospitals are damaged, especially in the west of the island. Field hospitals are now being built with international help. The total number of deaths rises to almost 60.",Procellae Melissae: Iamaica denuntiat constructionem valetudinarium agri. Hospitalia laeduntur praesertim in insulae occidentali. Campi valetudinaria auxilio internationali nunc aedificantur. Numerus funerum fere LX oritur.,2025-10-21 19:24:47+00:00
d081e175e8f519b607190576e1afd507,2025-11-08T20:27:22Z,'Wirbelsturm Schäden',www.zeit.de,de,0.1,Unwetter: Tornado trifft Südbrasilien: Stadt fast vollständig zerstört,Hier finden Sie Informationen zu dem Thema „Unwetter“. Lesen Sie jetzt „Tornado trifft Südbrasilien: Stadt fast vollständig zerstört“.,https://www.zeit.de/news/2025-11/08/tornado-trifft-suedbrasilien-stadt-fast-vollstaendig-zerstoert,https://img.zeit.de/news/2025-11/08/tornado-trifft-suedbrasilien-stadt-fast-vollstaendig-zerstoert-image-group/wide__1300x731,,"Ein Tornado hat im Süden Brasiliens schwere Verwüstungen angerichtet und mindestens sechs Menschen das Leben gekostet. Rund 750 Menschen wurden verletzt, mehr als 1.000 verloren ihr Zuhause, wie das … [+1967 chars]",,Unwetter: Tornado trifft Südbrasilien: Stadt fast vollständig zerstört. Hier finden Sie Informationen zu dem Thema „Unwetter“. Lesen Sie jetzt „Tornado trifft Südbrasilien: Stadt fast vollständig zerstört“.,Storm: Tornado hits southern Brazil: City almost completely destroyed. Here you will find information on the topic of “storms”. Now read “Tornado hits southern Brazil: city almost completely destroyed”.,"Storm: Turbo Brazil meridionali pervenit: urbs paene funditus deleta est. Hic informationes invenies in argumento ""procellae"". Nunc legitur ""Tornado Brasilia meridionali pervenit: urbs fere penitus destructa est"".",2025-10-21 19:24:47+00:00
c9505ce88582619cf8c12ab1ed3ae318,2025-11-11T23:20:02Z,'Wirbelsturm Schäden',www.tagesschau.de,de,0.1,Klima-Risiko-Index: Wetterextreme treffen arme Länder am härtesten,Laut Klima-Risiko-Index werden Extremwetter-Ereignisse immer häufiger - und treffen arme Länder am härtesten. Aber auch Deutschland bleibt dem Bericht zufolge von den Folgen des Klimawandels nicht verschont. Von Jakob Mayr.,https://www.tagesschau.de/wissen/klima/klima-risiko-index-102.html,https://images.tagesschau.de/image/03d0e824-a4ca-4a7c-8031-b95457141d2f/AAABmnU14W8/AAABmgWmh8Q/16x9-big/taifun-fung-wong-102.jpg?width=1280,,"Stand: 12.11.2025 00:20 Uhr
Laut Klima-Risiko-Index werden Extremwetter-Ereignisse immer häufiger - und treffen arme Länder am härtesten. Aber auch Deutschland bleibt dem Bericht zufolge von den Fol… [+4623 chars]",,Klima-Risiko-Index: Wetterextreme treffen arme Länder am härtesten. Laut Klima-Risiko-Index werden Extremwetter-Ereignisse immer häufiger - und treffen arme Länder am härtesten. Aber auch Deutschland bleibt dem Bericht zufolge von den Folgen des Klimawandels nicht verschont. Von Jakob Mayr.,"Climate Risk Index: Weather extremes hit poor countries hardest. According to the Climate Risk Index, extreme weather events are becoming more and more frequent - and are hitting poor countries the hardest. But according to the report, Germany is not spared from the consequences of climate change. By Jakob Mayr.","Clima Risk Index: Tempestas extrema miserorum regionibus ferire durissima est. Secundum in Climate Risk Index, eventus extremae tempestates frequentiores fiunt - et pauperes nationes durissimas feriunt. Sed secundum famam, Germania ab consequentibus mutationis climatis non parcitur. Apud Jacobum Mayr.",2025-10-21 19:24:47+00:00
33865ded82c9977efe802fac264fa99c,2025-11-03T15:02:20Z,'Tropensturm',www.tagesschau.de,de,0.9,Regenfälle und Überschwemmungen: Zahl der Toten in Vietnam steigt auf 37,Schwere Überschwemmungen und starker Regen: In Teilen Vietnams stehen seit einer Woche Häuser unter Wasser. 37 Menschen kamen bisher ums Leben. Jetzt nähert sich auch noch ein Tropensturm.,https://www.tagesschau.de/ausland/vietnam-ueberschwemmungen-100.html,https://images.tagesschau.de/image/1430b25f-1723-4454-8e94-a5463d9032de/AAABmkoyBAw/AAABmgWmh8Q/16x9-big/flut-vietnam-100.jpg?width=1280,,"Stand: 03.11.2025 16:02 Uhr
Schwere Überschwemmungen und starker Regen: In Teilen Vietnams stehen seit einer Woche Häuser unter Wasser. 37 Menschen kamen bisher ums Leben. Jetzt nähert sich auch noc… [+1781 chars]",,Regenfälle und Überschwemmungen: Zahl der Toten in Vietnam steigt auf 37. Schwere Überschwemmungen und starker Regen: In Teilen Vietnams stehen seit einer Woche Häuser unter Wasser. 37 Menschen kamen bisher ums Leben. Jetzt nähert sich auch noch ein Tropensturm.,Rains and floods: Death toll in Vietnam rises to 37. Severe floods and heavy rain: Houses have been under water in parts of Vietnam for a week. 37 people have died so far. Now a tropical storm is approaching.,Imbres et inundationes: Mors vectigal in Vietnam surgit ad 37. Gravi inundationes et pluviae graves: Domus sub aqua in partibus Vietnamiae hebdomadam fuerunt. 37 homines eatenus perierunt. Nunc tropica tempestas appropinquat.,2025-10-21 19:24:47+00:00
c4c3d11f8fe1aa2fdc49a617d9f29ef2,2025-11-04T08:29:06Z,'Taifun',www.tagesschau.de,de,0.9,Dauerregen und Sturmfluten: Taifun trifft Philippinen und bedroht Vietnam,In Südostasien hat ein Taifun die Philippinen erreicht. Mehrere Menschen kamen ums Leben. In den nächsten Tagen wird der Wirbelsturm in Vietnam erwartet. Dort kamen bei Überschwemmungen bereits mindestens 40 Menschen ums Leben.,https://www.tagesschau.de/ausland/asien/vietnam-philippinen-taifun-100.html,https://images.tagesschau.de/image/1ab01370-3d5a-4664-be0a-5f0c79db9678/AAABmk3oucc/AAABmgWmh8Q/16x9-big/taifun-philippinen-174.jpg?width=1280,,"Stand: 04.11.2025 09:29 Uhr
In Südostasien hat ein Taifun die Philippinen erreicht. Mehrere Menschen kamen ums Leben. In den nächsten Tagen wird der Wirbelsturm in Vietnam erwartet. Dort kamen bei Ü… [+2105 chars]",,Dauerregen und Sturmfluten: Taifun trifft Philippinen und bedroht Vietnam. In Südostasien hat ein Taifun die Philippinen erreicht. Mehrere Menschen kamen ums Leben. In den nächsten Tagen wird der Wirbelsturm in Vietnam erwartet. Dort kamen bei Überschwemmungen bereits mindestens 40 Menschen ums Leben.,"Constant rain and storm surges: Typhoon hits Philippines and threatens Vietnam. In Southeast Asia, a typhoon has hit the Philippines. Several people were killed. The cyclone is expected to hit Vietnam in the next few days. At least 40 people have already died in floods there.",Imbribus assiduis et tempestatibus exundat: Typhoon Philippines ferit et Vietnam minatur. In Asia Meridiana typhon Philippinas percutit. Occisi sunt complures. Cyclone expectatur ut Vietnam in proximos dies feriat. Saltem XL homines iam in diluviis ibi mortui sunt.,2025-10-21 19:24:47+00:00
d2006a40b6d186ae4044783fdcff0db1,2025-11-04T11:51:38Z,'Hurrikan',www.focus.de,de,0.9,„Niemand hilft uns“ – Touristenpaar kämpft verzweifelt um Rückkehr aus Jamaika,"Brandon aus Irland schenkte seiner Frau Lisa zum 50. Geburtstag eine Traumreise nach Jamaika. Dann kam Hurrikan ""Melissa"". Nun sitzen die beiden unter dramatischen Umständen fest.",https://www.focus.de/reisen/niemand-hilft-uns-touristenpaar-kaempft-verzweifelt-um-rueckkehr-aus-jamaika_a82cf83b-88c3-44ec-a791-591d11887b72.html,https://quadro.burda-forward.de/ctf/f0e5ff16-44cf-497c-8de2-f4a9ef1cd60b.2fa660cf-fe15-4bd2-bc0a-07cf4ec7a7dd.jpg?im=RegionOfInterestCrop%3D%281200%2C630%29%2CregionOfInterest%3D%28508%2C398%29&hash=ebe85eb3d7e741db6604b6188e5cc78e675d05bf09d04ee18e9db6c851055140,,"Das irische Ehepaar Lisa und Brendan Mooney sitzt nach dem Hurrikan ""Melissa"" in Jamaika fest. ""Melissa"" ist der stärkste Hurrikan, der Jamaika je direkt traf, und hat auf der Insel schwere Schäden a… [+2047 chars]",,"„Niemand hilft uns“ – Touristenpaar kämpft verzweifelt um Rückkehr aus Jamaika. Brandon aus Irland schenkte seiner Frau Lisa zum 50. Geburtstag eine Traumreise nach Jamaika. Dann kam Hurrikan ""Melissa"". Nun sitzen die beiden unter dramatischen Umständen fest.",“Nobody helps us” – tourist couple desperately fights to return from Jamaica. Brandon from Ireland gave his wife Lisa a dream trip to Jamaica for her 50th birthday. Then came Hurricane Melissa. Now the two are stuck under dramatic circumstances.,“Nemo nos adiuvat” – Tornacense copulam perdite pugnat ut ex Jamaica redeat. Brandonus ex Hibernia uxorem suam Lisam somnium iter ad Iamaicam 50th natalis dedit. Procellae deinde Melissae venit. Duo autem in rebus dramaticis haerent.,2025-10-21 19:24:47+00:00
2c181158054588ccc93cc10edd58738b,2025-11-04T13:15:36Z,'Wirbelsturm',www.tagesschau.de,de,0.9,Dauerregen und Sturmfluten: Tote und Verletzte durch Taifun auf Philippinen,In Südostasien hat ein Taifun die Philippinen erreicht. Trotz einer großen Evakuierungsaktion starben mindestens 26 Menschen. In den nächsten Tagen wird der Wirbelsturm in Vietnam erwartet.,https://www.tagesschau.de/ausland/asien/vietnam-philippinen-taifun-102.html,https://images.tagesschau.de/image/631a690d-508a-46da-971a-2525d963ada3/AAABmk70olI/AAABmgWmh8Q/16x9-big/taifun-philippinen-176.jpg?width=1280,,"Stand: 04.11.2025 14:15 Uhr
In Südostasien hat ein Taifun die Philippinen erreicht. Trotz einer großen Evakuierungsaktion starben mindestens 26 Menschen. In den nächsten Tagen wird der Wirbelsturm i… [+2610 chars]",,Dauerregen und Sturmfluten: Tote und Verletzte durch Taifun auf Philippinen. In Südostasien hat ein Taifun die Philippinen erreicht. Trotz einer großen Evakuierungsaktion starben mindestens 26 Menschen. In den nächsten Tagen wird der Wirbelsturm in Vietnam erwartet.,"Continuous rain and storm surges: dead and injured by typhoon in Philippines. In Southeast Asia, a typhoon has hit the Philippines. Despite a large evacuation operation, at least 26 people died. The cyclone is expected to hit Vietnam in the next few days.","Imbres continuae et procellae exundationes: mortuae et laesae a typhonibus in Philippinis. In Asia Meridiana typhon Philippinas percutit. Quamvis magna evacuatio operationis, saltem XXVI homines mortui sunt. Cyclone expectatur ut Vietnam in proximos dies feriat.",2025-10-21 19:24:47+00:00
651d52bed124160f4c879c01ae78c38d,2025-11-04T14:29:25Z,'Taifun',www.bild.de,de,0.9,Mindestens 26 Tote - Taifun verwüstet die Philippinen,"Taifun „Kalmaegi“ verwüstet die Philippinen, zwingt 400.000 zur Flucht, 26 Menschen ertrinken.",https://www.bild.de/news/ausland/taifun-verwuestet-die-philippinen-mindestens-26-tote-6909eaea0580923d09986d28,"https://images.bild.de/6909eaea0580923d09986d28/8e7541de8679d721fbbd79da53615190,dc240406?w=1280",,"Manila (Philippinen)  Ein gewaltiger Taifun hat die Philippinen in Chaos und Elend gestürzt. Ganze Ortschaften wurden überschwemmt. Mindestens 26 Menschen kamen ums Leben.
Schlammige Fluten rissen i… [+1742 chars]",,"Mindestens 26 Tote - Taifun verwüstet die Philippinen. Taifun „Kalmaegi“ verwüstet die Philippinen, zwingt 400.000 zur Flucht, 26 Menschen ertrinken.","At least 26 dead as typhoon devastates Philippines. Typhoon “Kalmaegi” devastates the Philippines, forcing 400,000 people to flee and 26 people drowning.","Saltem XXVI mortuus est ut typhon Philippinas vastat. Typhoon ""Kalmaegi"" Philippinas vastat, quadraginta milia hominum in fugam vertit et 26 homines submersit.",2025-10-21 19:24:47+00:00
9c5a7dce931cadad84c5bc34d6b540d2,2025-11-05T03:49:24Z,'Wirbelsturm Tote',www.tagesspiegel.de,de,0.9,"Autos türmen sich, Menschen fliehen auf Dächer: Taifun hinterlässt Zerstörung auf den Philippinen – 66 Tote","Der Taifun „Kalmaegi“ hat Hunderttausende Philippiner in die Flucht getrieben. Während die Opferzahl steigt, nähert sich schon der nächste Sturm.",https://www.tagesspiegel.de/gesellschaft/panorama/autos-turmen-sich-menschen-fliehen-auf-dacher-taifun-hinterlasst-zerstorung-auf-den-philippinen--66-tote-14758472.html,https://www.tagesspiegel.de/images/14758469/alternates/BASE_16_9_W1400/1762314563000/taifun-kalmaegi-philippinen.jpeg,,"Auf den Philippinen steigt die Zahl der Toten durch den schweren Taifun Kalmaegi. Mindestens 66 Menschen kamen nach Angaben des Zivilschutzes ums Leben, 26 weitere werden noch vermisst. 
Sechs der O… [+3072 chars]",,"Autos türmen sich, Menschen fliehen auf Dächer: Taifun hinterlässt Zerstörung auf den Philippinen – 66 Tote. Der Taifun „Kalmaegi“ hat Hunderttausende Philippiner in die Flucht getrieben. Während die Opferzahl steigt, nähert sich schon der nächste Sturm.","Cars pile up, people flee to roofs: Typhoon leaves destruction in the Philippines - 66 dead. Typhoon Kalmaegi has displaced hundreds of thousands of Filipinos. While the number of victims rises, the next storm is already approaching.","Carros struunt, fugiuntque ad tecta: Typhoon exit in Philippinis - 66 mortuus. Typhoon Kalmaegi centena milia Filipinos deposuit. Dum numerus victimarum surgit, proxima tempestas iam appropinquat.",2025-10-21 19:24:47+00:00
301af7afed29717f8294552afdc7359f,2025-11-05T03:49:24Z,'Taifun',www.tagesspiegel.de,de,0.9,Tropensturm in Südostasien: Taifun hinterlässt Zerstörung auf den Philippinen - 66 Tote,"Autos türmen sich, Menschen fliehen auf ihre Dächer: Der Taifun „Kalmaegi“ hat Hunderttausende Philippiner in die Flucht getrieben. Während die Opferzahl steigt, nähert sich schon der nächste Sturm.",https://www.tagesspiegel.de/gesellschaft/panorama/tropensturm-in-sudostasien-taifun-hinterlasst-zerstorung-auf-den-philippinen-66-tote-14758472.html,https://www.tagesspiegel.de/images/14758469/alternates/BASE_16_9_W1400/1762314563000/taifun-kalmaegi-philippinen.jpeg,,"Auf den Philippinen steigt die Zahl der Toten durch den schweren Taifun Kalmaegi. Mindestens 66 Menschen kamen nach Angaben des Zivilschutzes ums Leben, 26 weitere werden noch vermisst. Sechs der Opf… [+2732 chars]",,"Tropensturm in Südostasien: Taifun hinterlässt Zerstörung auf den Philippinen - 66 Tote. Autos türmen sich, Menschen fliehen auf ihre Dächer: Der Taifun „Kalmaegi“ hat Hunderttausende Philippiner in die Flucht getrieben. Während die Opferzahl steigt, nähert sich schon der nächste Sturm.","Tropical storm in Southeast Asia: Typhoon leaves destruction in the Philippines - 66 dead. Cars are piling up, people are fleeing to their roofs: Typhoon “Kalmaegi” has forced hundreds of thousands of Filipinos to flee. While the number of victims rises, the next storm is already approaching.","Tempestas tropica in Asia Australi: Typhonis interitum relinquit in Philippinis - 66 mortuis. Cars struunt, homines ad tecta fugiunt: Typhoon ""Kalmaegi"" centena milia Filipinos fugere coegit. Dum numerus victimarum surgit, proxima tempestas iam appropinquat.",2025-10-21 19:24:47+00:00
b0bea478b9acab0183d93fd1597b04fc,2025-11-05T03:49:24Z,'Taifun',www.tagesspiegel.de,de,0.9,"Autos türmen sich, Menschen fliehen auf Dächer: Taifun „Kalmaegi“ hinterlässt Zerstörung und Tote auf den Philippinen","Der Taifun „Kalmaegi“ hat Hunderttausende Philippiner in die Flucht getrieben. Mindestens 66 Menschen sterben. Während die Opferzahl steigt, nähert sich schon der nächste Sturm.",https://www.tagesspiegel.de/gesellschaft/panorama/autos-turmen-sich-menschen-fliehen-auf-dacher-taifun-kalmaegi-hinterlasst-zerstorung-und-tote-auf-den-philippinen-14758472.html,https://www.tagesspiegel.de/images/14758469/alternates/BASE_16_9_W1400/1762314563000/taifun-kalmaegi-philippinen.jpeg,,"Auf den Philippinen steigt die Zahl der Toten durch den schweren Taifun Kalmaegi. Mindestens 66 Menschen kamen nach Angaben des Zivilschutzes ums Leben, 26 weitere werden noch vermisst. 
Sechs der O… [+3072 chars]",,"Autos türmen sich, Menschen fliehen auf Dächer: Taifun „Kalmaegi“ hinterlässt Zerstörung und Tote auf den Philippinen. Der Taifun „Kalmaegi“ hat Hunderttausende Philippiner in die Flucht getrieben. Mindestens 66 Menschen sterben. Während die Opferzahl steigt, nähert sich schon der nächste Sturm.","Cars pile up, people flee to roofs: Typhoon “Kalmaegi” leaves destruction and deaths in the Philippines. Typhoon Kalmaegi has displaced hundreds of thousands of Filipinos. At least 66 people die. While the number of victims rises, the next storm is already approaching.","Cars struunt, ad tecta fugiunt: Typhoon ""Kalmaegi"" exitii et mortes in Philippinis relinquit. Typhoon Kalmaegi centena milia Filipinos deposuit. LXVI certe moriuntur. Dum numerus victimarum surgit, proxima tempestas iam appropinquat.",2025-10-21 19:24:47+00:00
12d99d9a8fca20594d862b2e252135d8,2025-11-05T10:13:03Z,'Taifun',www.n-tv.de,de,0.9,"90 Tote durch Taifun ""Kamaegi"": Philippinen erleben weitere schwere Naturkatastrophe","Kurz nach Hurrikan ""Melissa"" in der Karibik fallen nun auf der anderen Seite der Welt dem Taifun ""Kamlaegi"" Dutzende Menschen zum Opfer. Es ist bereits die dritte schwere Naturkatastrophe auf den Philippinen seit September. Jetzt nimmt der Sturm Kurs auf Viet…",https://www.n-tv.de/panorama/Philippinen-erleben-weitere-schwere-Naturkatastrophe-article26141965.html,https://www.n-tv.de/img/incoming/crop26141972/7481328912-cImg_16_9-w1200/556731536.jpg,,"Kurz nach Hurrikan ""Melissa"" in der Karibik fallen nun auf der anderen Seite der Welt dem Taifun ""Kamlaegi"" Dutzende Menschen zum Opfer. Es ist bereits die dritte schwere Naturkatastrophe auf den Phi… [+2220 chars]",,"90 Tote durch Taifun ""Kamaegi"": Philippinen erleben weitere schwere Naturkatastrophe. Kurz nach Hurrikan ""Melissa"" in der Karibik fallen nun auf der anderen Seite der Welt dem Taifun ""Kamlaegi"" Dutzende Menschen zum Opfer. Es ist bereits die dritte schwere Naturkatastrophe auf den Philippinen seit September. Jetzt nimmt der Sturm Kurs auf Viet…","90 dead from typhoon “Kamaegi”: Philippines is experiencing another serious natural disaster. Shortly after hurricane ""Melissa"" in the Caribbean, dozens of people are now falling victim to typhoon ""Kamlaegi"" on the other side of the world. It is the third serious natural disaster in the Philippines since September. Now the storm is heading towards Vietnam...","90 a typhon ""Kamaegi"" mortuum: Philippines aliam gravem naturalem calamitatem experitur. Paulo post turbo ""Melissa"" in Caribbean, justos hominum victimae ad typhon ""Kamlaegi"" in alia parte mundi nunc cadunt. Tertia post Septembrem gravis est clades naturalis in Philippinis. Tempestas est versus Vietnam ...",2025-10-21 19:24:47+00:00
dd4840e46e54f1f242799927b8964707,2025-11-05T13:16:08Z,'Taifun',www.zeit.de,de,0.9,Tropensturm in Südostasien: Taifun hinterlässt Zerstörung auf den Philippinen - 91 Tote,Hier finden Sie Informationen zu dem Thema „Tropensturm in Südostasien“. Lesen Sie jetzt „Taifun hinterlässt Zerstörung auf den Philippinen - 91 Tote“.,https://www.zeit.de/news/2025-11/05/taifun-hinterlaesst-zerstoerung-auf-den-philippinen-66-tote,https://img.zeit.de/news/2025-11/05/taifun-hinterlaesst-zerstoerung-auf-den-philippinen-66-tote-image-group/wide__1300x731,,"Auf den Philippinen steigt die Zahl der Toten durch den schweren Taifun «Kalmaegi». Mindestens 91 Menschen kamen nach Angaben des Zivilschutzes ums Leben, 75 weitere werden noch vermisst. Sechs der O… [+2110 chars]",,Tropensturm in Südostasien: Taifun hinterlässt Zerstörung auf den Philippinen - 91 Tote. Hier finden Sie Informationen zu dem Thema „Tropensturm in Südostasien“. Lesen Sie jetzt „Taifun hinterlässt Zerstörung auf den Philippinen - 91 Tote“.,Tropical storm in Southeast Asia: Typhoon leaves destruction in the Philippines - 91 dead. Here you will find information on the topic “Tropical Storm in Southeast Asia”. Now read “Typhoon leaves destruction in the Philippines - 91 dead”.,"Tempestas tropica in Asia Australi: Typhonis interitum relinquit in Philippinis - 91 mortuis. Hic reperies informationem de argumento ""Tropical Storm in Southeast Asia"". Nunc legitur ""Typhoni exitii relinquit in Philippinis - 91 mortuis"".",2025-10-21 19:24:47+00:00
a40180da6a466c1316afd60d029b7850,2025-11-06T02:52:20Z,'Wirbelsturm',www.tagesspiegel.de,de,0.9,Katastrophe in Südostasien: Mindestens 140 Tote nach Taifun auf den Philippinen – nächster Wirbelsturm kommt,"Autos auf Dächern, Dörfer im Schlamm: Der Wirbelsturm „Kalmaegi“ hinterlässt viele Opfer und Chaos in dem Inselstaat. Jetzt nähert sich der Sturm „Fung-Wong“ – wird er zum Supertaifun?",https://www.tagesspiegel.de/gesellschaft/panorama/katastrophe-in-sudostasien-mindestens-140-tote-nach-taifun-auf-den-philippinen--nachster-wirbelsturm-kommt-14769275.html,https://www.tagesspiegel.de/images/14769515/alternates/BASE_16_9_W1400/1762408228000/over-110-died-state-of-calamity-declared-amid-aftermath-of-typhoon-kalmaegi.jpeg,,"Drama auf den Philippinen: Die Zahl der Toten in dem Inselstaat ist durch den verheerenden Taifun Kalmaegi weiter gestiegen. Mindestens 114 Menschen kamen ums Leben, die Behörden in der Provinz Cebu … [+3099 chars]",,"Katastrophe in Südostasien: Mindestens 140 Tote nach Taifun auf den Philippinen – nächster Wirbelsturm kommt. Autos auf Dächern, Dörfer im Schlamm: Der Wirbelsturm „Kalmaegi“ hinterlässt viele Opfer und Chaos in dem Inselstaat. Jetzt nähert sich der Sturm „Fung-Wong“ – wird er zum Supertaifun?","Catastrophe in Southeast Asia: At least 140 dead after typhoon in the Philippines – next cyclone is coming. Cars on roofs, villages in the mud: The cyclone “Kalmaegi” leaves behind many victims and chaos in the island state. Now the storm “Fung-Wong” is approaching – will it become a super typhoon?","Catastrophe in Asia Meridiana: Saltem 140 mortuus post typhonium in Philippinis – cyclone proximus venit. Cars in tectis, pagis in luto: Cyclone ""Kalmaegi"" multas victimas et chaos in civitate insula relinquit. Tempestas iam ""Fung-Wong"" appropinquat - fiet super typhon?",2025-10-21 19:24:47+00:00
