index,published,keyword,domain,language,valid,title,description,url,image,archive,content,quote,de,en,la,added
fad92abaee9252cc8d044b1cea008db4,2026-07-06T03:59:30Z,'Wirbelsturm',www.diepresse.com,de,0.9,Supertaifun „Bavi“ erreicht US-Außengebiete im Pazifik,Der Taifun zieht mit Windgeschwindigkeiten von 290 Kilometern pro Stunde über die Insel Rota hinweg. Der NWS warnt vor „katastrophalen Schäden und einer lebensbedrohlichen Lage“.,https://www.diepresse.com/35220214/supertaifun-bavi-erreicht-us-aussengebiete-im-pazifik,https://img.diepresse.com/public/incoming/teqwe-topshot-us-guam-mariana-weather-typhoon/alternates/WEBP_WIDE_1200/TOPSHOT-US-GUAM-MARIANA-WEATHER-TYPHOON,,"Die Presse auf Google als bevorzugte Nachrichtenquelle hinzufügen.
 Der Supertaifun Bavi ist auf der Insel Rota in den US-Außengebieten im Pazifik auf Land getroffen und hat dort Behördenangaben zuf… [+1197 chars]",,Supertaifun „Bavi“ erreicht US-Außengebiete im Pazifik. Der Taifun zieht mit Windgeschwindigkeiten von 290 Kilometern pro Stunde über die Insel Rota hinweg. Der NWS warnt vor „katastrophalen Schäden und einer lebensbedrohlichen Lage“.,Super typhoon “Bavi” reaches US territories in the Pacific. The typhoon hits the island of Rota with wind speeds of 290 kilometers per hour. The NWS warns of “catastrophic damage and a life-threatening situation.”,"Eximius typhon ""Bavi"" attingit fines US in Pacifico. Typhon insulam Rotam cum velocitatibus ventorum 290 chiliometrorum per hora pervenit. NWS monet ""damnum calamitosum ac condicionem vitae minacem"".",2026-07-07 15:48:13+00:00
7949412c70c796d68d5212535647f7d0,2026-07-06T04:22:16Z,'Wirbelsturm',www.derstandard.at,de,0.9,"Supertaifun ""Bavi"" erreichte US-Außengebiete im Pazifik","Der Taifun richtete auf der Insel Rota ""erhebliche Schäden"" an. Der US-Wetterdienst NWS bezeichnete den Wirbelsturm als ""sehr gefährlich""",https://www.derstandard.at/story/3000000330175/supertaifun-bavi-erreichte-us-au223engebiete-im-pazifik,https://i.ds.at/b83inA/rs:fill:1200:600/plain/lido-images/2026/07/06/70dc9526-e84b-428f-9dd2-a93d5e17bc2f.jpg,,"Sie entscheiden darüber, wie Sie unsere Inhalte nutzen wollen. Ihr Gerät erlaubt uns derzeit leider nicht, die entsprechenden Optionen anzuzeigen.
Bitte deaktivieren Sie sämtliche Hard- und Software… [+180 chars]",,"Supertaifun ""Bavi"" erreichte US-Außengebiete im Pazifik. Der Taifun richtete auf der Insel Rota ""erhebliche Schäden"" an. Der US-Wetterdienst NWS bezeichnete den Wirbelsturm als ""sehr gefährlich""",Super typhoon “Bavi” reached US territories in the Pacific. The typhoon caused “significant damage” on the island of Rota. The US weather service NWS described the hurricane as “very dangerous”,"Eximius typhon ""Bavi"" ad fines US in Pacifico pervenit. Typhon ""damnum significans"" in insula Rota effecit. US tempestas ministerium NWS describit Arctos quod ""periculosum""",2026-07-07 15:48:13+00:00
32e280bcd635bb6f9cd3a586c2e77c0d,2026-07-07T08:00:32Z,'Taifun',www.tagesschau.de,de,0.9,Unwetter: Tote und Vermisste nach Fluten und Erdrutsch in China,"Regenfälle, Tornados und Erdrutsche: In China sind bei heftigen Unwettern mehrere Menschen gestorben, viele werden noch vermisst. Die Lage bleibt angespannt, ein Taifun soll am Wochenende Taiwan treffen.",https://www.tagesschau.de/ausland/asien/china-erdrutsch-128.html,https://images.tagesschau.de/image/186708c9-f848-4817-bac4-5b3e2326a3d2/AAABnztqNnU/AAABnSSvrFg/16x9-big/china-unwetter-102.jpg?width=1280,http://web.archive.org/web/20260707184654/https://www.tagesschau.de/ausland/asien/china-erdrutsch-128.html,"Stand: 07.07.2026 10:00 Uhr
Regenfälle, Tornados und Erdrutsche: In China sind bei heftigen Unwettern mehrere Menschen gestorben, viele werden noch vermisst. Die Lage bleibt angespannt, ein Taifun s… [+3335 chars]",,"Unwetter: Tote und Vermisste nach Fluten und Erdrutsch in China. Regenfälle, Tornados und Erdrutsche: In China sind bei heftigen Unwettern mehrere Menschen gestorben, viele werden noch vermisst. Die Lage bleibt angespannt, ein Taifun soll am Wochenende Taiwan treffen.","Storm: dead and missing after floods and landslides in China. Rainfall, tornadoes and landslides: Several people have died in violent storms in China, and many are still missing. The situation remains tense, a typhoon is expected to hit Taiwan this weekend.","Tempestas: mortua et defuit post diluvia et proruit in Sinis. Imbres, turbines et ruinae: Plures homines in vehementibus procellis in Sinis mortui sunt, et multi adhuc desunt. Status temporis manet, expectatur typhon ut Taiwan hoc weekend ferire.",2026-07-09 16:08:15+00:00
